DS,product_name,ean,stock
FOREST,La Serenisima Yogurt Batido Descremado Clasico Sabor Vainilla - Generic Brand - 120 g,7791337007413,6
FOREST,Sampling Meet Hard Seltzer Mango 310 ml,7790950142174,0
FOREST,Jack Daniels Whisky Importado Tennesse Old N 7 - Jack Daniels - 700 ml,82184090473,0
FOREST,Beefeater Gin Blood Orange - Generic Brand - 700 ml,5000299618240,0
FOREST,La Serenisima Yogur Entero Natural Con Cereales - Generic Brand - 159 g,7791337007390,6
FOREST,Marlboro Cigarrillos Red - Mia - 10 ud.,77940315,0
FOREST,Trumpeter Vino Rosado Malbec - Generic Brand - 750 mL,7790577040983,6
FOREST,Perdriel Vino Sauvignon Blanc - Generic Brand - 750 mL,7792319677662,6
FOREST,Rabieta Cerveza Red IPA - Generic Brand - 473 mL,7798339250236,0
FOREST,Absolut Vodka Grapefruit - Absolut - 750 mL,7312040552160,0
FOREST,Aquarius Agua Saborizada Pera 500 Ml - Generic Brand - 500 ml,7790895640445,6
FOREST,H2oh Agua Saborizada Limon Sin Gas - Generic Brand - 500 mL,7791813402022,6
FOREST,Cusenier Granadina - Generic Brand - 750 mL,7792410517348,0
FOREST,Schneider Cerveza Negra - Mia - 473 mL,7793147571085,0
FOREST,Desodorante Axe Green Geran - Generic Brand - 150 mL,7506306249998,6
FOREST,Absolut Vodka Raspberri Suecia - Absolut - 750 mL,7312040040759,0
FOREST,Glade Desodorante de Ambiente Tropical Floral en Aerosol - Generic Brand - 380 mL,7790520028792,6
FOREST,Glade Desodorante de Ambiente Limon en Aerosol - Generic Brand - 380 mL,7790520998279,6
FOREST,Ballantines Whisky - Ballantines - 750 mL,5010106111536,0
FOREST,Alicante Mix Especias a Las Brasas  - Generic Brand - 25 g,7790150532706,6
FOREST,Kunstmann Session Ipa - Generic Brand - 470 mL,7802107000876,0
FOREST,Arcor Mermelada de Frutilla - Generic Brand - 454 g,7790580132187,6
FOREST,Rabieta Cerveza Golden Ale - Generic Brand - 473 mL,7798339250144,0
FOREST,Rabieta Cerveza APA - Generic Brand - 473 mL,7798339250229,0
FOREST,Pepsi Gaseosa 70Kcal - Generic Brand - 500 ml,7791813888406,6
FOREST,Loreal Paris-Dermo Expertise Crema Ojos Revitalift Hialuronico  - Generic Brand - 28 g,7509552840346,6
FOREST,Absolut Lime (Formato Nuevo) - Mia - 700 mL,7312040551668,0
FOREST,Beefeater 24 (Formato Nuevo) - Mia - 700 mL,5000299605004,0
FOREST,Chivas Whisky 12 Años (Formato Nuevo) - Mia - 700 ml,80432402931,0
FOREST,Dove Mascara Capilar Regeneracion Extrema - Generic Brand - 300 g,7791293048659,6
FOREST,Absolut Vanilia (Formato Nuevo) - Mia - 700 mL,7312040350100,0
FOREST,Jameson Caskmates Ipa (Formato Nuevo) - Mia - 700 mL,5011007025960,0
FOREST,Jameson Black Barrel (Formato Nuevo) - Mia - 700 mL,5011007024000,0
FOREST,Guinness Cerveza Extra Stout - Mia - 473 mL,7798339251509,0
FOREST,REGALO Álbum de Figuras Mundial Coca-Cola - Mia - 1 ud.,7897653539802,0
FOREST,[NCP] ETIQUETA  FRISELINA TURBO 60X130 MM,9910015491304,0
FOREST,Figuritas Mundial para combos COCA-COLA - Mia - 1 ud.,9910015476291,0
FOREST,[NCP] BOL DE PAP TIPO SOBRE TURBO 13X4 CM,9910015491289,0
FOREST,[NCP] CIERRABOL AUTOADHESIVO TURBO,9910015491290,0
FOREST,Dove Mascara Capilar Hidratacion - Generic Brand - 300 g,7791293050881,6
FOREST,[NCP] BOL TURBO PAP MEDIANAS 28X15X40 CM,9910015491273,0
FOREST,[NCP] BOL TURBO PAP CHICA 22X10X24 CM,9910015491272,0
FOREST,[NCP] BOL TURBO PAP CHICA SM 22X10X30 CM,9910015491326,0
FOREST,[NCP] BOL TURBO PAP GRANDE SM 35X15X47 CM,9910015491327,0
FOREST,Colgate Pasta Dental Herbal - Generic Brand - 140 ud.,7509546686387,0
FOREST,Tregar Tops Yogur Descremado Con Copos - Generic Brand - 164 ml,7793913002355,0
FOREST,Tregar Yogur Cremoso Entero Con Cereales Azucarados - Generic Brand - 164 g,7793913002348,0
FOREST,Regalo Salta Cautiva Cerveza Rubia - Generic Brand - 1 ud.,9910015459335,0
FOREST,Regalo Le Banana Bites Chocolate con Leche - Generic Brand - 1 ud.,9910015478336,0
FOREST,Regalo Le Banana Bites Chocolate Amargo - Generic Brand - 1 ud.,9910015478337,0
FOREST,Regalo Michelob Ultra Cerveza - Generic Brand - 1 ud.,9910015459338,0
FOREST,Ruca Malen Capitulo Uno Vino Chardonnay - Generic Brand - 750 ml,7790070650931,0
FOREST,Ruca Malen Capitulo Uno Vino Cabernet Sauvignon - Generic Brand - 750 ml,7790070650948,0
FOREST,Ruca Malen Capitulo Dos Vino Malbec - Generic Brand - 750 ml,7790070651044,0
FOREST,La Fuerza Vermouth Rojo - Generic Brand - 750 ml,7791728238723,6
FOREST,AIMÉ Vino Cabernet Sauvignon - Generic Brand - 750 ml,7790070760494,0
FOREST,Don Nicanor Barrel Select Vino Malbec - Generic Brand - 750 ml,7793440001555,0
FOREST,Sancor Bebe Advanced 1 - Generic Brand - 200 ml,7798176000698,0
FOREST,Sancor Bebe Advanced 3 - Generic Brand - 200 ml,7798176000711,0
FOREST,Diabla Blend Calm - Generic Brand - 200 g,7798415090213,6
FOREST,LUCKY TABACO CRAFT 30grs,7798363320172,6
FOREST,Nesquik Menosazucar Nuevo 12X300Gar - Generic Brand - 300 g,8445290559975,6
FOREST,Sancor Bebé 1 Leche en Polvo Infantil - Generic Brand - 375 g,7798176009745,0
FOREST,Sancor Bebe Advanced 2 - Generic Brand - 200 g,7798176000704,0
FOREST,Sancor Bebe 2 Leche en Polvo Infantil - Generic Brand - 375 g,7798176009769,0
FOREST,Vino DaDa blanco finca las moras vino blanco honey 6 - Generic Brand - 750 ml,7791540050251,6
FOREST,Pura Frutta Jugos Manzana Roja - Generic Brand - 200 ''Unidad de Medida'',7798259430091,0
FOREST,Lata Chocolates Shot  lata chocolates shot  - Generic Brand - 15 g,9910015412419,6
FOREST,Pura Frutta Jugo Exprimido de Manzana Verde - Generic Brand - 200 ''Unidad de Medida'',7798259430107,0
FOREST,Madalenas Vainilla - Generic Brand - 200 g,7793890020045,0
FOREST,Madalenas Rellenas con Dulce de Leche - Generic Brand - 190 g,7793890020069,0
FOREST,Pampers Babydry Peq 56Padsx03It - Generic Brand - 855 g,7500435228756,6
FOREST,Pampers Babysan Xxg 08Padsx16It - Generic Brand - 115 g,7500435228657,6
FOREST,Rexona Antitranspirante Xtracool - Generic Brand - 150 ml,7791293049601,6
FOREST,Capsulas Clásico 4X10X 4.5 Gr. - Generic Brand - 45 g,7792360097044,6
FOREST,Fanta Pomelo 500ml - Generic Brand - 500 ml,7790895001055,0
FOREST,Capsulas Lungo 4X10X6 Gr - Generic Brand - 45 g,7792360097051,6
FOREST,Coca-Cola Sabor Original - Generic Brand - 1250 ml,7790895012266,0
FOREST,Nobleza Gaucha Serena X 1Kg Sin Tacc - Generic Brand - 1000 g,7790070509116,6
FOREST,Old Smuggler Whisky Aejo - Generic Brand - 750 mL,7798131200613,6
FOREST,Dogui Alimento Para Perros Con Carne Pollo Cereales Y Vegetales 1.5KG - Generic Brand - 1500 g,7613287613356,6
FOREST,Aquarius Agua Saborizada Naranja - Generic Brand - 1500 ml,7790895641237,0
FOREST,Powerade Manzana - Generic Brand - 995 ml,7790895006036,0
FOREST,Powerade Mountain Blast - Generic Brand - 995 ml,7790895006029,0
FOREST,FELIX Gatitos 500g - Generic Brand - 500 g,8445291463134,6
FOREST,Mylanta Extra Tabletas x 24 - Generic Brand - 24 ''Unidad de Medida'',7796285275426,0
FOREST,Evatest Test de Embarazo Rápido Simple - Generic Brand - 1 ''Unidad de Medida'',7796285284565,0
FOREST,Uvasal Naranja x 15 Sobres Dobles - Generic Brand - 15 ''Unidad de Medida'',7794640130700,0
FOREST,Alenix Rapida Accion Capsula Blanda - Generic Brand - 1 ''Unidad de Medida'',7796285278748,0
FOREST,Vino Tinto Latitud 33 Malbec 750Ml - Generic Brand - 750 ml,7790975204062,6
FOREST,Cafiaspirina - Cafiaspirina - 30 ''Unidad de Medida'',7793640000761,0
FOREST,Cafe La Virginia  Puro Aroma Grano Pa 500 Gr - Generic Brand - 500 g,7790150006429,6
FOREST,Tafirol Tafirol Forte - Generic Brand - 30 ''Unidad de Medida'',7798140250395,0
FOREST,Ibupirac Plus Max - Generic Brand - 400 ''Unidad de Medida'',7795381411578,0
FOREST,Alikal Clásico x 30 Sobres - Generic Brand - 30 ''Unidad de Medida'',7794640170850,0
FOREST,Te Tilo Manzanilla En Sobres La Virginia X 25 Uni - Generic Brand - 71 g,7790150321065,6
FOREST,Uvasal 2 Sobres - Generic Brand - 15 ''Unidad de Medida'',7794640131400,0
FOREST,Buscapina Fem Comprimidos x 6 - Generic Brand - 6 ''Unidad de Medida'',7798389330117,0
FOREST,Tafirol Plus Rapida Accion 8 u Blandas - Generic Brand - 8 ''Unidad de Medida'',7798140258445,0
FOREST,Uvasal Naranja Frasco - Generic Brand - 100 ''Unidad de Medida'',7794640170058,0
FOREST,Antitr. Nivea Men Dry Fre/Imp. X150Ml - Generic Brand - 150 ml,4005900973856,6
FOREST,Aziatop 20 Mg Cápsulas x 14 - Generic Brand - 14 ''Unidad de Medida'',7796285051792,0
FOREST,Fabogesic (400 Mg) - Generic Brand - 10 ''Unidad de Medida'',7798032935096,0
FOREST,102Plus 102 Años Plus - Generic Brand - 30 ''Unidad de Medida'',7791984000485,0
FOREST,Tafirol Migra - Generic Brand - 10 ''Unidad de Medida'',7798140258667,0
FOREST,Ibupirac Ibupirac Capsula Blanda 400 Mg Cßps. Blandas x 12 - Generic Brand - 400 ''Unidad de Medida'',7795381001748,0
FOREST,Fideos Dedalitos Lucchetti X 500 Grs - Generic Brand - 500 g,7790070318398,6
FOREST,Evatest Prueba de Embarazo Classic - Generic Brand - 1 ''Unidad de Medida'',7796285273941,0
FOREST,Sertal Perlas Cápsulas Blandas x 10 - Generic Brand - 10 ''Unidad de Medida'',7795345121512,0
FOREST,Fideos Terrabusi Coditos X500G Paq-0.5-Kg - Generic Brand - 500 g,7790070335678,6
FOREST,Ibuevanol Ibu Evanol Max Ra Cápsulas Blandas x 20 - Generic Brand - 20 ''Unidad de Medida'',7794640172601,0
FOREST,Cafiaspirina Plus - Cafiaspirina - 20 ''Unidad de Medida'',7793640000778,0
FOREST,Ibuevanol Ibu Evanol Forte Ra Cápsulas Blandas x 20 - Generic Brand - 20 ''Unidad de Medida'',7794640172021,0
FOREST,Arroz Integral Gallo Oro Bolsa X500Gr - Generic Brand - 500 g,7790070433152,6
FOREST,Queso Crema Clásico Casancrem 500Gr (Rojo) - Generic Brand - 500 g,7791337061491,6
FOREST,Sal.Horneado Picante 4X6X100G - Generic Brand - 122 g,7790040141254,6
FOREST,Ibupirac Capsulas Blandas 400 x 24 - Generic Brand - 24 ''Unidad de Medida'',7795381001755,0
FOREST,Treg 20 Mg Capsulas x 15 - Generic Brand - 15 ''Unidad de Medida'',7790839980910,0
FOREST,M&M Mani Con Chocolate - 49 g,7797453001458,0
FOREST,Next - Next - 10 ''Unidad de Medida'',650240010538,0
FOREST,Aerotina Aerotina - Generic Brand - 10 ''Unidad de Medida'',7798084680128,0
FOREST,Actron Blandas - Generic Brand - 20 ''Unidad de Medida'',7793640215486,0
FOREST,Uvasal Frasco - Generic Brand - 100 ''Unidad de Medida'',7794640130830,0
FOREST,Merm Frutilla Lc Selec 12X390G - Generic Brand - 611 g,7793360129896,6
FOREST,Tafirol Tafirol Plus - Generic Brand - 16 ''Unidad de Medida'',7798140258636,0
FOREST,SANCOR BEBE 2 ADV  STICKS (BOLSA 60X15G),7798181641688,6
FOREST,Actron Blandas - Generic Brand - 10 ''Unidad de Medida'',7793640992752,0
FOREST,LASFOR Almohaditas Chocolate Suizo x200g,7798169802667,6
FOREST,Sedal Ac Ceramidas 12X340Ml,7791293045931,6
FOREST,Sedal Ac Carbon Y Peonias Ia 12X340Ml,7791293047706,6
FOREST,Sedal Ac Prebioticos + Biotina 12 x 340 mL,7791293049762,6
FOREST,Tresemme Spray Hydra Oil 6X120Ml,7891150087453,6
FOREST,Vivere Suav Viol Y F Bcas Exp Fl Dp 4X3L,7791290793712,6
FOREST,Sun Progress Lv Vaj Sal 7X1Kg,7805000321970,6
FOREST,Ala Camellito Liq Lv R Fina H Dp15X450Ml,7791290795259,6
FOREST,Mylanta Comprimidos Masticables Frutilla Silvestre - Generic Brand - 24 ''Unidad de Medida'',7796285275433,0
FOREST,Granby Liq Lv Ropa Be Limon Dp 12X800Ml,7791290795112,6
FOREST,Benadryl 24 x - Generic Brand - 10 ''Unidad de Medida'',7796285001124,0
FOREST,Grandwich Roll De Lomo Horneado,7798024767223,6
FOREST,Glycolic Bright Serum 30Ml,7509552930672,6
FOREST,Glycolic Bright Night Cream 50Ml,7509552930665,6
FOREST,Aerotina 10 Mg Capsulas Blandas - Generic Brand - 10 ''Unidad de Medida'',7798084683228,0
FOREST,Bulnez Sal Entrefina,7791720031759,6
FOREST,Alenix Alernix Blandas x 10 - Generic Brand - 24 ''Unidad de Medida'',7796285271749,0
FOREST,Ibuevanol Ibu Evanol Max Ra Cápsulas Blandas x 10 - Generic Brand - 10 ''Unidad de Medida'',7794640171208,0
FOREST,Colgate Plax Enjuague Bucal Menta Fresca - Colgate - 250 ml,7509546686356,0
FOREST,Vanish Quitamanchas Pink 50%  +  Poder Pre Lavado Trigger 500 mL,7791130001755,6
FOREST,Evatest Digital Env. X 1 - Generic Brand - 1 ''Unidad de Medida'',7796285275303,0
FOREST,Actron Mujer Forte - Generic Brand - 10 ''Unidad de Medida'',7793640215547,0
FOREST,Antigripal - Generic Brand - 1 ''Unidad de Medida'',7795381411585,0
FOREST,Ibupirac Fem Comprimidos x 10 - Generic Brand - 10 ''Unidad de Medida'',7795381001656,0
FOREST,Benadryl 24 Flash Comprimidos x 10 - Generic Brand - 10 ''Unidad de Medida'',7796285053109,0
FOREST,Lysol Desinfectante Marina 1800 Ml,7791130962230,6
FOREST,Ser Yogur Batido Parcialmente Descremado Sabor Vainilla,7791337008564,6
FOREST,Yogurisimo Bebible C/ Probioticos Frutilla Sachet Fort. ,7791337008625,6
FOREST,Papas C/Amer. Krachitos X 50G,7794520869324,6
FOREST,Fn Autentico Malbec 750Cc,7797942007046,6
FOREST,Rexona Desodorante Para Pies Efficient Original en Aerosol - Generic Brand - 1 ''Unidad de Medida'',7791293044460,0
FOREST,RC Sussex Clasico Mas Blanco 50 Paños 3 x 10 M - Generic Brand - 3 ud.,7790250056881,0
FOREST,Milka Chocolate Importado Triple Chocolate - Generic Brand - 90 ''Unidad de Medida'',7622210609908,0
FOREST,Milka Chocolate Importado Triple Caramelo - Generic Brand - 90 ''Unidad de Medida'',7622210609885,0
FOREST,Fn Autentico Rose 750Cc,7797942007060,6
FOREST,Regalo Tresemmé 2 Sobres (Shampoo-Acondicionador) - Generic Brand - 1 ud.,9910015442340,0
FOREST,Ades Almendra 1 Lt,7790895649806,6
FOREST,Revlon Primer Photoready Rose Glow Hidratante  +  Iluminador,309970144869,6
FOREST,maybelline brillo labial lifter gloss ice,41554583861,6
FOREST,Cerveza Stella Artois 330cc,7792798010578,6
FOREST,Vino Cafayate Reserve Chardonnay,7790093132940,6
FOREST,Empanadas Zen Jamon Y Quesos,7798353140186,6
FOREST,Miller Rubia Bot 600 Cc,7793147570262,6
FOREST,Nan Optipro 1 X 190Ml,8445290180087,6
FOREST,Powerade Frutas Tropicales 1.5L,7790895011269,6
FOREST,Powerade Manzana 1.5L,7790895011245,6
FOREST,Cofler Chocolate con Rocklets - Generic Brand - 100 g,7790580103552,0
FOREST,Cofler Tableta Graffiti - Generic Brand - 45 g,7790580111755,0
FOREST,Always Toallita Femenina Triple Accion Plus Suave - Generic Brand - 16 ud.,7500435178846,0
FOREST,Comfort Suavizante Para Ropa Cuidado Esencial Doypack - Generic Brand - 450 ml,7791290793583,0
FOREST,Dove Desodorante en Aerosol Original 72 hs - Generic Brand - 150 ml,7791293048468,0
FOREST,Dove Desodorante en Aerosol Invisible Dry 72 hs - Generic Brand - 150 ml,7506306241176,0
FOREST,Gaseosa Regular Doble Cola 2250 mL,7791913001859,6
FOREST,Rexona Antitranspirante en Aerosol Mujer Active Emotion - Generic Brand - 150 ml,7791293045153,0
FOREST,Ser Protein Botellita Frutilla y Arándanos x190g,7791337009820,6
FOREST,Cif Detergente Bioactive Lima Doypack - Generic Brand - 450 ml,7791290794092,0
FOREST,Rina Matarazzo Passata 12X500G,7790070100313,6
FOREST,Salsa Napol Premium Lc X350G,7790580144197,6
FOREST,Ndg Americano 10Caps X80G Qb,7891000421048,6
FOREST,Ndg Lungo 10Caps X70G Qb,7891000421390,6
FOREST,Soja Texturizada X 350G - Dicomere,7793323004789,6
FOREST,Tableta 70% Cacao Con Almendras Y Coco X 50G - Dr Cacao,606110439831,6
FOREST,Smookies Galletitas Dulces Pera X 150G - Smookies,7798166860028,6
FOREST,Dove Acondicionador Regeracion Extrema - Generic Brand - 200 ml,7791293047072,0
FOREST,Dove Shampoo Regeracion Extrema - Generic Brand - 200 ml,7791293047003,0
FOREST,Skip Jabon Liquido Concentrado Para Ciclo Corto Frescura Activa Doypack 800 Ml,7791290796454,6
FOREST,Tresemme Acondicionador Cauterizacion Reparadora - Generic Brand - 250 g,7791293050003,0
FOREST,Tresemme Acondicionador Keratina Antifrizz - Generic Brand - 500 ml,7791293049946,0
FOREST,Flandria Tabaco Silver 30g,5411786063502,6
FOREST,Cif Antigrasa Bioactive Doypack - Generic Brand - 450 ml,7791290794399,0
FOREST,Cif Bioactive Limpiador para Baño Repuesto - Generic Brand - 450 ml,7791290794429,0
FOREST,Coca Cola Light 600 Ml,7790895650864,6
FOREST,Knorr Salsa Pomarola Tradicional - Generic Brand - 340 g,7794000008007,0
FOREST,Sprite Zero 600 Ml,7790895650895,6
FOREST,Alma Mora Alma Mora Vino Malbec - Mia - 750 ml,7790240042108,7
FOREST,Poett Desodorante de Ambientes Alegra tu Día  - Mia - 360 mL,7793253004316,7
FOREST,Knorr Caldo Balance Verdura con Vegetales - Generic Brand - 12 g,7794000008519,0
FOREST,Protector Dermico Oleo Calcareo - Generic Brand - 250 mL,7797811099301,7
FOREST,Alamos Vino Malbec   - Mia - 750 mL,7794450000781,7
FOREST,Pura Frutta Jugo Orgánico Manzana - Generic Brand - 1 l,7798259439209,0
FOREST,De Cecco Fideos Spaghetti - Generic Brand - 500 g,8001250120120,7
FOREST,Gatorade Isotonicas Cool Blue - Mia - 1250 mL,7792170110704,7
FOREST,L'abratto Jamon Cocido Natural Feteado - Generic Brand - 125 g,7790079019159,0
FOREST,Huggies Toalla Humeda Triple Proteccion Con oleo - Huggies - 48 ud.,7794626010217,7
FOREST,Task Bolsas De Residuos 50x70cm - Task - 20 Und,7794321550216,7
FOREST,Eco de Los Andes Agua Mineral Con Gas - Generic Brand - 1500 mL,7792799000073,7
FOREST,Benjamin Vino Malbec - Generic Brand - 750 ml,7790070760579,7
FOREST,Serenito Postre Vainilla - Generic Brand - 100 g,7791337008434,0
FOREST,Paso de Los Toros Pomelo - Generic Brand - 500 ml,7791813420385,7
FOREST,Harpic Limpiador Para Inodoros Blanco Y Brillante Bot - Harpic - 500 ml,7791130681438,7
FOREST,Copa Caja Mondelez  +  Vino - Generic Brand - 1 Ud.,9910015476343,0
FOREST,TASK Bolsas De Residuos Plana 50x70 cm - Generic Brand - 10 ud.,7794321550018,0
FOREST,Mogul Extreme Gomita Acida Arandano - Generic Brand - 8 g,7790580138417,0
FOREST,Dove Men Desodorante Roll On Cuidado Total - Mia - 50 ml,78927254,7
FOREST,Mogul Extreme Gomita Acida Tutti Fruti - Generic Brand - 8 g,7790580138783,0
FOREST,Mogul Extreme Gomita Acida Sandia - Generic Brand - 8 g,7790580138790,0
FOREST,Purina ONE Gato Adulto Pollo & Carne - Generic Brand - 500 g,7613287230362,7
FOREST,Bon o Bon Bocaditos Helados Citos Pote - Generic Brand - 180 g,7790580111243,0
FOREST,Coflercitos Bombones Helados de DDL - Generic Brand - 180 g,7790580135874,0
FOREST,Águila Helado Granizado - Generic Brand - 250 g,7790580112578,0
FOREST,Cofler Bock Gelato Helado Chocolate con Mani - Generic Brand - 250 g,7790580135348,0
FOREST,Bon o Bon Blanco Helado Corazón - Generic Brand - 60 ,7790580139667,0
FOREST,Águila Helado En Barrita - Generic Brand - 34 ,7790580118969,0
FOREST,Purina ONE Gato Adulto Pollo & Salmon - Generic Brand - 500 g,7613287230423,7
FOREST,El Esteco Vino Malbec Don David - Generic Brand - 750 ml,7790189001129,7
FOREST,Cofler Blockazo Chocolate Con Mani - Generic Brand - 1000 g,7790580115579,0
FOREST,Apósitos Adhesivos Curitas Sensitive,7501054550648,7
FOREST,Magistral Ultra Detergente Aloe - Generic Brand - 750 ml,7500435216449,0
FOREST,Pantene Shampoo Colageno - Generic Brand - 400 g,7500435137928,0
FOREST,Pantene Acondicionador Colágeno - Generic Brand - 400 g,7500435138345,0
FOREST,Colgate Crema Dental Triple Acción Tubo Reciclable - Generic Brand - 90 g,7509546686523,7
FOREST,Cerrito Tabaco Chocolate 40G,7730104034283,7
FOREST,Mach3 Sensitive Cartuchos Repuesto - Generic Brand - 4 Und,7500435185219,0
FOREST,"Grandwich Max Premium Pollo, Rucula y Parmesano - Generic Brand - 180 g",7798024766172,7
FOREST,Gillette Venus Tropical Maquinas de Afeitar Desechables - Generic Brand - 3 Und,7500435105699,0
FOREST,Oral B Indicator Plus 35 Soft Cepillos de Dientes - Generic Brand - 2 ud.,7500435024594,0
FOREST,Oral-B Crema Dental Complete 4 en 1 - Generic Brand - 70 g,7500435122764,0
FOREST,Always Diarios Plus Protectores Respirables Sin Perfume - Generic Brand - 15 Und,7500435178792,0
FOREST,Tomate Perita - Mia - 1 ud.,9910015403051,7
FOREST,Kit Kat Helado - Generic Brand - 61 g,7899975801964,0
FOREST,Purina ONE Perro Adulto Grande Pollo & Cordero - Generic Brand - 2 kg,7613287227294,7
FOREST,Prime Preservativo de Látex Prime Hiper Fino - Generic Brand - 6 ud.,7791519702761,0
FOREST,Emilia Espumante Extra Brut - Generic Brand - 750 ml,7790070760999,7
FOREST,Pura Frutta Jugo Multifruta Kids - Generic Brand - 200 ml,7798259439513,0
FOREST,Pura Frutta Jugo Manzana Kids - Generic Brand - 200 ml,7798259439520,0
FOREST,Pura Frutta Jugo Naranja Kids - Generic Brand - 200 ml,7798259439582,0
FOREST,Novecento Extra Dulce - Generic Brand - 750 ml,7790717001195,7
FOREST,Acondicionador Oleo Extraordinario Nutricion Elvive L'Oreal - Full - 400 ml,7509552791280,7
FOREST,Kotex Toalla Femenina Nocturna - Kotex - 16 ud.,7794626011566,7
FOREST,Doritos Dinamita Picantes - Generic Brand - 70 g,7790310987001,0
FOREST,Gallo Arroz Listo Queso  - Generic Brand - 240 g,7790070432261,7
FOREST,La Campagnola Mermelada Ciruela - Generic Brand - 454 g,7793360131424,7
FOREST,Powerade Manzana - Powerade - 500 ml,7790895640018,7
FOREST,Cerealitas Clasicas Tripack - Generic Brand - 621 g,7622201745905,7
FOREST,Arcor Arvejas Secas Remojadas - Generic Brand - 300 g,7790580132392,7
FOREST,Vienissima Salchichas Sin Piel - Generic Brand - 12 g,7790670051077,0
FOREST,Buhero Fernet - Generic Brand - 700 mL,7792410523165,7
FOREST,Amargo Obrero - Generic Brand - 950 mL,7790950001969,7
FOREST,CAMEL BOX 20,77977205,7
FOREST,Rexona Desodorante Masculino V8 72 Horas en Aerosol - Generic Brand - 150 ml,7791293049489,7
FOREST,Paladini Jamon Cocido Feteado Fino - Generic Brand - 200 g,7790079022593,7
FOREST,Vienissima Salchichas Sin Piel - Generic Brand - 6 g,7790670051060,0
FOREST,Paladini Lomo Cocido Feteado - Generic Brand - 120 g,7790079019562,7
FOREST,Sapo de Otro Pozo Blend de Tintas - Generic Brand - 750 ml,7798353194837,7
FOREST,Aleluya Mostaza con Miel Suave - Generic Brand - 200 ,7790158229615,0
FOREST,Pehuamar Papas fritas - Generic Brand - 135 g,7790310985366,7
FOREST,Nutrilon Profutura 1 - Generic Brand - 200 ml,7795323775324,7
FOREST,La Serenísima Cremón Doble Crema Queso Fraccionado - Generic Brand - 500 g,9910015400345,0
FOREST,La Serenisima Port Salut Queso Reducido en Calorias - Generic Brand - 500 g,9910015400346,0
FOREST,Coca-Cola Sin Azucar Gaseosa - Generic Brand - 1250 ml,7790895012273,0
FOREST,Sprite Gaseosa Lima Limón - Sprite - 1250 ml,7790895012358,0
FOREST,Pringles Papas Fritas Original - Generic Brand - 104 g,7896004009155,7
FOREST,Norton Reserva Vino Malbec - Norton - 750 ml,7792319972774,7
FOREST,Mega Almendras - Generic Brand - 74 g,7891000120057,7
FOREST,Los Prados Morcilla Atada Envasada Al Vacio  - Refrigerada,8280040003,7
FOREST,Veet Crema Depilatoria Sensible 100 ml - Veet - 1 ud.,8002990292139,7
FOREST,Rexona Desodorante en Talco Efficient Original 100 Gr,7791293044477,7
FOREST,Ramazzotti Aperitivo Rosato - Generic Brand - 700 ml,7792410779357,7
FOREST,Tequeños Deditos de Queso - Generic Brand - 6 ,2970600000183,0
FOREST,Medialunas de Grasa  - Generic Brand - 3 ud.,2970600000213,0
FOREST,La Planta de Cafe Torrado Molido  - Generic Brand - 250 g,7790550000157,7
FOREST,Alicante Mix Especias Criollo Sobre - Generic Brand - 25 g,7790150532300,7
FOREST,Dove Men Clinical Aer Cuidado Total 96H - Generic Brand - 110 ml,2200000312488,0
FOREST,Cat Chow Gatitos Pes Car Y Veg - Generic Brand - 1 kg,8445290069313,7
FOREST,Cif Expert Antigrasa - Generic Brand - 500 ml,7791290795570,7
FOREST,Cif Expert Baño - Generic Brand - 500 ml,7791290795594,7
FOREST,Colgate Total 12 Pasta Dental Carbon Activado - Generic Brand - 90 g,7509546686042,0
FOREST,Colgate Total 12 Enjuague Bucal Carbon - Generic Brand - 250 ml,7509546686622,0
FOREST,Crudencio Galletas Sabor Limon - Generic Brand - 90 g,701822744546,7
FOREST,El Peoncito Maiz Pisingallo - Generic Brand - 500 g,7791351001268,7
FOREST,Actimel Leche Fermentada Multifruta Sin Azucar  - Generic Brand - 100 ml,7791337007826,0
FOREST,Serenito Postre Vainilla Con Rocklets - Generic Brand - 120 g,7791337008472,0
FOREST,Aconcagua Ginebra Handcrafted - Generic Brand - 750 mL,749350080354,7
FOREST,"Crush Gaseosa Pomelo Amarillo 2,25 Lt - Crush - 2250 ml",7790895007392,7
FOREST,Whiskas Alimento Humedo Para Gatito Sabor a Carne  - Whiskas - 85 g,7797453000406,7
FOREST,Whiskas Alimento Humedo para Gatos Sabor Pescado - Whiskas - 85 g,7797453001496,7
FOREST,Limpiador Desinfectante Cif en Gatillo - Generic Brand - 400 mL,7791290795747,7
FOREST,Beaudroit Yogurt Artesanal Descremado Sabor a Vainilla - Generic Brand - 160 g,7798327950087,7
FOREST,Terma Aperitivo Serrano sin Azucar - Generic Brand - 1750 mL,7790950144093,7
FOREST,Los Arboles Vino Tinto Malbec - Generic Brand - 750 mL,7791250000935,7
FOREST,Cordero Con Piel de Lobo Vino Tinto Cabernet - Generic Brand - 750 mL,7798353194660,7
FOREST,Desodorante en Aerosol Axe Aqua Citrus - Generic Brand - 150 mL,7506306249974,7
FOREST,LAUR Aceite de Oliva Virgen Extra - Generic Brand - 250 g,7798090730299,0
FOREST,ACETAIA MILLAN Aceto Balsamico - Generic Brand - 250 g,7798159944902,0
FOREST,LAUR Aceitunas Descaroza Verdes - Generic Brand - 160 g,7798159945459,0
FOREST,Pura Frutta Jugo de Naranja Salustiana - Generic Brand - 1 l,7798259439537,0
FOREST,Deo Axe Blue Lavanda - Generic Brand - 150 mL,7506306249981,7
FOREST,Loreal Paris Gel de Limpieza Hidratante Revitalift - Generic Brand - 172 g,7509552849646,7
FOREST,COFLER Galletas COOKIES Chocolate  - Generic Brand - 105 g,7790040143753,7
FOREST,Heredero Gin Premium Mesopotamia Argentina - Generic Brand - 700 ml,724751009876,7
FOREST,Beaudroit Yogur Natural Deslactosado - Generic Brand - 160 g,7798327950162,7
FOREST,[NCP] NUEVA BOLSA TURBO CHICA SIN MANIJA 22X10,9910015491348,0
FOREST,[NCP] NUEVA BOLSA TURBO MEDIANA CON MANIJA 28X,9910015491349,0
FOREST,Kay Yogurt Griego 750g - Generic Brand - 750 g,7798432770037,7
FOREST,Pepsi Gaseosa Cola - Pepsi - 2 l,7791813555094,0
FOREST,Quilmes Hinchada - Generic Brand - 473 ml,7792798013913,0
FOREST,Chesterfield Blue Motion Box 12 - Manantial - 12 Und,77953964,7
FOREST,Matarazzo Pasta Spaghetti Libre De Gluten 500G - Generic Brand - 500 g,7790070336002,7
FOREST,El Enemigo Cabernet Franc - Generic Brand - 750 mL,7794450003645,0
