DS,product_name,ean,stock
FOREST,La Serenísima Yogur Clásico Descremado Vainilla Sachet - Generic Brand - 900 G,7791337004931,0
FOREST,Cruz Malta Yerba Mate Seleccion Especial - Generic Brand - 500 g,7790070507389,0
FOREST,Colón Selecto Vino Syrah Malbec - Mia - 750 ml,7790168903987,0
FOREST,Mosquita Muerta Vino Blanco mosquita muerta vino blanco - Generic Brand - 750 ml,7798353194790,3
FOREST,Fruver 73 - Mia - 1 ud.,9910015403046,0
FOREST,Ser Yogur con Cereal con Probióticos Berries - Generic Brand - 155 ml,7791337007789,0
FOREST,Fruver 4 - Mia - 1 ud.,9910015421020,0
FOREST,Gillette Mach3 Máquina Para Afeitar Recargable - Gillette - 1 ud.,7500435198110,0
FOREST,Pampers Babydry Gde 44Padsx04It - Generic Brand - 672 g,7500435228732,3
FOREST,Elite Extra Servilletas de Mesa Hoja Simple Paquete 120 Und - Generic Brand - 120 ud.,7790250023814,0
FOREST,LA MERCED MONTE YERBA MATE 500GR,7790387015614,0
FOREST,Natier Capsulas de Colageno - Generic Brand - 50 g,7798121272507,3
FOREST,Morixe Fideo Spaghetti - Generic Brand - ''Presentación'' 1 G,7790199603467,0
FOREST,Franks Bizcochitos con Semillas - Generic Brand - 100 g,7798340790301,3
FOREST,La Virginia Café Instantáneo Suave Espuma Instantánea - Generic Brand - 170 g,7790150101476,0
FOREST,Portobellos Agroecológicos Premium en bandeja - Mia - 1 ud.,9910015421062,0
FOREST,Ensalada Del Cheff - Mia - 1 ud.,9910015467177,0
FOREST,Pep Palitos Común - Generic Brand - 40 g,7790310006818,0
FOREST,Bic Encendedor Bx7 - Bic - 7 ud.,3086123206878,0
FOREST,Ser Mousse Chocolate - Generic Brand - 70 G,7791337004436,0
FOREST,Ile De France Queso Brie Fran Cja - Generic Brand - 125 g,3161712996146,0
FOREST,Exquisita Lemonies 12X425G - Generic Brand - 425 g,7790070432865,3
FOREST,Se Sussex Clásica Hs 30 x 30 Blanca X80/30 - Generic Brand - 114 G,7790250057765,3
FOREST,Dicomere Azúcar Mascabo Sin Refinar - Generic Brand - 500 g,7793323004840,0
FOREST,Fruver 106 - Mia - 1 ud.,9910015421063,0
FOREST,Premezcla Lucchetti Pizza 4 Pizzas - Mia - 850 g,7790070507976,0
FOREST,POT Paleta Helada de Dulce de Leche. dulce de leche natural y cobertura de chocolate blanco crocante. - Generic Brand - 100 g,9910015385428,3
FOREST,Nucete Aceitunas Verdes Descarozadas - Mia - 80 g,7792070001065,0
FOREST,Comfort Suavizante Para Ropa Clásico - Generic Brand - 900 mL,7791290010444,0
FOREST,Doritos Sabor Queso - Mia - 140 g,7790310984208,0
FOREST,Krachitos Chizitos Queso 60gr - Generic Brand - 60 g,7794520869003,3
FOREST,Gati Alimento Para Gato Adulto Sabor Carne y Pollo 1kg - Generic Brand - 1000 g,8445290585240,3
FOREST,Fruver 132 - Mia - 1 ud.,9910015421049,0
FOREST,Artesano Pan Bimbo - Artesano - 500 g,7793890258967,0
FOREST,Alicante Cocina en Bolsa Sabor Tipo Barbacoa - Generic Brand - 27 g,7790150497753,0
FOREST,Dove Antitranspirante Original Roll On 50 mL,78924468,0
FOREST,De Cecco Salsa Arrabiata - Generic Brand - 200 g,8001250069146,3
FOREST,Mermelada Bonne Maman 4 Frutas 370 gr,3045320089363,3
FOREST,Ciboulette - Generic Brand - 1 Und,9910015421452,3
FOREST,Lucchettinis Jamon Y Queso Lucchetti X 500 Grs - Generic Brand - 500 g,7790070317452,3
FOREST,Fideos Al Huevo Spaghetti Lucchetti X 500 Grs - Generic Brand - 500 g,7790070337108,3
FOREST,Fideos Tirabuzon 3 Vegetales Terrabusi X 500 Grs - Generic Brand - 500 g,7790070336071,3
FOREST,Cif Detergente Lavavajilla Limón - Generic Brand - 500 ml,7791290792609,0
FOREST,Salamin Tandilero Ahumado Cagnoli X 145 Gr - Generic Brand - 145 g,7798013108082,3
FOREST,Milkaut Queso Mozzarella - Mia - 500 g,7794820000373,0
FOREST,Yogurisimo Yogurt Entero Firme Vainilla - Generic Brand - 120 g,7791337007581,0
FOREST,Alicante Pimentón Sin Tacc - Generic Brand - 200 Gr,7790150565469,0
FOREST,Merm Frut/Rojos Lc Sel12X390G - Generic Brand - 611 g,7793360129919,3
FOREST,Milanesa De Nalga Canavesi x 840gr  - Mia - 840 g,8999999999938,0
FOREST,Fruver 129 - Mia - 1 ud.,9910015421065,0
FOREST,Mingo Hard Seltzer Maracuyá G&C - Generic Brand - 355 ml,7791540053955,0
FOREST,Cachafaz Galletitas Avena Y Chips - Mia - 225 g,7798128000691,0
FOREST,Baby Sec Premium Pañales Talle G - Generic Brand - 22 ud.,7790250047162,0
FOREST,La Serenisima Leche Larga Vida Entera Clasica 3% Caja - Generic Brand - 1 l,7790742363008,0
FOREST,Muecas Pasas Barra de Cereal de Uva y Almendras  - Muecas - 45 g,7798333090050,0
FOREST,Nestle Pureza Vital Agua Mineral Sin Gas - Generic Brand - 500 ml,7792799000899,0
FOREST,Mer. Light Arc Ciruel  + F 12 x 390 - Generic Brand - 605 G,7790580132248,3
FOREST,Chocolate Milka Bis  - Mia - 106 g,7622210788207,0
FOREST,Cerveza Dos Dingos Pilsen - Mia Regular Price - 330 ml,7798345250190,0
FOREST,Morixe Aceitunas Verdes Enteras - Generic Brand - ''Presentación'' 1 G,7790199603030,0
FOREST,Tom.Cub.Salsati.24X400G.Singlu - Generic Brand - 465 g,7790580147266,3
FOREST,Sonrisas Frambuesa 36X108G - Generic Brand - 109 g,7790040133488,3
FOREST,Copa Menstrual Carecup Talle 2 - Mia - 1 u,7798171947318,0
FOREST,Dove Acondicionador Ritual de Reparación Coco y Cúrcuma - Dove - 200 ml,7791293045290,0
FOREST,Onneg Avocado Dip - Generic Brand - 220 g,7798255730034,0
FOREST,Fruver 131 - Mia - 1 ud.,9910015421066,0
FOREST,Alimento Para Perros Pedigree 3 Kg. Adultos Carne Pollo Y Cereales,7797453001533,3
FOREST,Bonafide Galletas Donuts de Chocolate Blanco - Generic Brand - 78 g,7792360096825,0
FOREST,LASFOR Copos de Maiz Naturales x200g,7798169802773,3
FOREST,Coca-Cola Light - Coca-Cola Light - 500 ml,7790895001482,0
FOREST,El Peoncito Villares Frutas Secas - Generic Brand - 100 g,7791351130135,0
FOREST,De mi Campo Ají Molido 50 Grs. - Mia - 50 g,7798089091653,0
FOREST,Coca-Cola Sin Azúcar - Coca-Cola Sin Azucar - 1750 ml,7790895012259,0
FOREST,Acelga Triple Lavado - Mia - 250 g,724751031136,0
FOREST,3D Mega Conitos Sabor Queso - Generic Brand - 23 g,7790310983461,0
FOREST,Mirinda Naranja - Mirinda - 354 ml,7791813333029,0
FOREST,Elite Pañuelitos Descartables 10 Pañuelos - Generic Brand - 6 ud.,7790250054962,0
FOREST,Pantene Shampoo Pro V Bambu - Generic Brand - 400 ml,7500435212458,0
FOREST,Fanta Naranja - Fanta - 1500 mL,7790895000454,0
FOREST,Cerveza Dos Dingos Aussie Ipa - Mia Regular Price - 330 ml,7798345250213,0
FOREST,Ayudin Desinfectante En Aerosol Bebé - Generic Brand - 332 ml,7793253003364,0
FOREST,Godet Gelatina Frutilla Sobre - Generic Brand - ''Presentación'' 1 G,7790580110697,0
FOREST,Vino Tinto Malbec Finca Gabriel - Generic Brand - 750 mL,7798112630026,0
FOREST,SNUKS Almohaditas Frutilla SIN TACC x240g,7798169802711,3
FOREST,Hershey's Chocolate Con Leche - Hersheys - 92 G,7899970400018,0
FOREST,Dove Baby Acondicionador H Enriquecida H Enriquecida - Dove Baby - 200 ml,7891150036390,0
FOREST,Baby Sec Premium Pañales Talle XG - Generic Brand - 18 ud.,7790250047179,0
FOREST,Aquarius Uva 500 Ml,7790895641206,3
FOREST,Sedal Sh Ceramidas 12X650Ml,7791293045795,3
FOREST,De mi Campo Orégano 10 Grs - Mia - 10 g,7798089091608,0
FOREST,Levite Agua Saborizada Naranja Sin Gas - Levite - 1500 ml,7798062548648,0
FOREST,Pep Ramitas Queso 120Gx21,7790310985182,3
FOREST,Kansas Salsa Honey Mustard - Generic Brand - 410 g,7798334803086,0
FOREST,Fruver 87 - Mia - 2 ud.,9910015403068,0
FOREST,Vat 69 Whisky Escocés - Generic Brand - 700 ml,7791250002977,0
FOREST,Pantene Pro V Repara Restauracion Crema Para Peinar - Pantene - 300 mL,7506309837246,0
FOREST,1890 Cerveza Rubia - Generic Brand - 473 cc,7792798013951,0
FOREST,Dulce De Frambuesa Organico X 352G,7793482300081,3
FOREST,NO INGRESAR STOCK Te La Virginia Clásico x 25U - Mia - 25 ud.,D7790150211793,0
FOREST,Cadbury Chocolate Intense 50 % Cacao - Generic Brand - 25 g,7622201818609,0
FOREST,Milkaut Yogurt Descremado Con Granola (Formato Anterior) - Generic Brand - 155 g,7794820901915,0
FOREST,Agronola Cacao X 400G,7798395860035,3
FOREST,La Serenísima Dulce de Leche Tradición Argentina - Generic Brand - 400 g,7790742625502,0
FOREST,Agronola Avena Y Miel X 400G,7798395860028,3
FOREST,Antares Cerveza Scotch - Generic Brand - 500 ml,7798091030107,0
FOREST,Takis Original 1P 49G Flow Bar Exp,7500810034491,3
FOREST,H2OH! Naranchelo - Generic Brand - 1500 ml,7791813421511,0
FOREST,Sushi Combo Salmón Caja - Mia - 1 ud.,9910015467123,0
FOREST,Cerveza Blest Ipa - Mia Regular Price - 473 ml,7798119090144,0
FOREST,Takis Fuego 1P 140G Flow Bar Exp,7500810034330,3
FOREST,"Bravía Kombucha Power Manzana Verde, Guaraná y Cayena - Generic Brand - 354 ml",724751090157,0
FOREST,SE VA A ELIMINAR Minerva Limón - Minerva - 250 cc,7790070507379,0
FOREST,Knorr Caldo De Carne Caldo Cubo 12 Cubos - Knorr - Caja 1 g,7794000597532,0
FOREST,Taragüi Té de Hierbas Silvestres Mezcla Digestivas - Generic Brand - 25 Ud.,7790387712018,0
FOREST,La Serenisima Yogur Descremado Cremoso Frutilla - Generic Brand - 120 g,7791337007406,0
FOREST,Alaris Cabernet Sauvignon - Trapiche - 750 mL,7790240107500,0
FOREST,Jameson y Sprite de Regalo - Mia - 1 ud.,9910015487246,0
FOREST,Kellogg's Zucaritas Cereal Copos de Maíz - Zucaritas - 300 G,7896004006369,0
FOREST,Zorro Jabon Liquido Ropa Evolution Diluible,7790990001509,3
FOREST,Milka Huevo de Pascuas Chocolate con Leche - Generic Brand - 170 g,7622210549716,0
FOREST,"Bravía Kombucha Power Frutilla, Naranja y Pimienta Rosa - Generic Brand - 354 ml",724751090164,0
FOREST,Molto Arvejas - Generic Brand - 340 g,7798138552838,0
FOREST,Limpiador Liquido Desinfectante Concentrado Para Pisos Lysoform Lavanda Botella 900Ml 800 Ml,7790520989949,3
FOREST,Cachafaz Galletitas Organicas de Avena y Miel - Generic Brand - 170 g,7798128002138,0
FOREST,Gillette Venus Simply3 Máquinas Para Afeitar Desechables (Formato Anterior) - Gillette Venus - 2 ud.,7702018072392,0
FOREST,Cerveza Blest Pilsen - Mia Regular Price - 473 ml,7798119090113,0
FOREST,La Salteña Tapas Para Pascualinas Hojaldre - Generic Brand - 400 g,7790070622044,0
FOREST,Alicante Salsa Blanca - Generic Brand - 40 g,7790150580424,0
FOREST,Alicante Pimienta Negra En Grano - Generic Brand - 25 g,7790150556337,0
FOREST,Fond de Cave Vino Blanco Reserva Chardonnay - Trapiche - 750 ML,7790240094626,0
FOREST,Taragüi te Hierbas Silvestres Ensuenos x 25 Saquitos - Generic Brand - 25 Und,7790387712445,0
FOREST,Yogurisimo Yogur Con Granola Y Chips De Chocolate ,7791337007659,3
FOREST,KoNos Bbq X 45G,7794520869546,3
FOREST,Fruver 116 - Mia - 1 ud.,9910015403070,0
FOREST,Papas C/Amer. Krachitos X 105G,7794520869331,3
FOREST,Felices Las Vacas Yogurt Vainilla - ''Presentación'' de 1 G,7798338250060,0
FOREST,Milka Chocolate Leche - Generic Brand - 20 ,7622210795625,0
FOREST,maybelline superstay labial líquido vinyl ink lippy,41554071047,3
FOREST,Bauducco Galletitas Obleas Fresas - Generic Brand - 140 g,7891962032283,0
FOREST,maybelline máscara de pestañas sky high cosmic,41554071863,3
FOREST,Colón Selecto Vino Cabernet Sauvignon - Mia - 750 ml,7790168903833,0
FOREST,rimmel london delineador líquido glam eyes,3607344174083,3
FOREST,Fruver 127 - Mia - 1 ud.,9910015421125,0
FOREST,Cerveza Blest Scotch - Mia Regular Price - 473 ml,7798119090137,0
FOREST,maybelline delineador líquido hyper precise liq liner,3600530730308,3
FOREST,Sueño Verde Kale Listo para Consumir - Mia - 300 g,7798096881247,0
FOREST,maybelline brillo labial lifter gloss tono 006 reef,41554583908,3
FOREST,maybelline superstay labial líquido vinyl ink wicked,41554070972,3
FOREST,Taragüi te Placeres Manzana Canela Miel x 20 Saquitos - Generic Brand - 20 Und,7790387013306,0
FOREST,Espuña Jamon Crudo - Generic Brand - 100 g,7790079023293,0
FOREST,BAUDUCCO OBLEA CHOCOLATE 78GR,7891962058399,0
FOREST,maybelline superstay labial líquido vinyl ink cheeky,41554071023,3
FOREST,Colón Selecto Vino Chardonnay - Mia - 750 ml,7790168903802,0
FOREST,Smirnoff Aperitivo Ice Greenapple - Smirnoff - 473 ml,7791250003127,0
FOREST,maybelline superstay labial líquido vinyl ink coy,41554071009,3
FOREST,Nivea Jabón Lavanda & Óleos - Generic Brand - 3 ud.,4005900990433,0
FOREST,maybelline labial líquido superstay vinyl ink tono punchy,41554079302,3
FOREST,rimmel mascara extra 3d lash extreme black,3607342923904,3
FOREST,Trapiche Vino Reserva Malbec - Trapiche - 750 ML,7790240094459,0
FOREST,Pringles Papas Original - Pringles - 124 g,38000184963,0
FOREST,revlon paleta de sombra de ojos colorstay looks book,309970039042,3
FOREST,La Serenísima Yogur Clásico Entero Frutilla - Generic Brand - 900 G,7791337605527,0
FOREST,Burganas Medallones De Tomate Seco Y Aduki X 460G,7798346740164,3
FOREST,Session Cerveza Session Ipa K24.7 - Patagonia - 730 mL,7792798002399,0
FOREST,La Campagnola Salsati Tomate Perita Lata  - Generic Brand - 400 g,7793360000294,0
FOREST,Nivea Jabon Cremoso Pure Milk - Nivea - 100 g - Generic Brand - 100 g,4005900990518,0
FOREST,Palitos Mostaza Mcc 110Gr,7794520869577,3
FOREST,Taragüi te Placeres Limon Miel x 20 Saquitos - Generic Brand - 40 G,7790387013344,0
FOREST,Apio Listo Para Consumir,2210015421554,3
FOREST,Gaseosa Limon Cero Pritty x 2250 mL,7791913001163,3
FOREST,Fancy Feast Gato Alimento Húmedo Casserole con Atún & Salmón - Generic Brand - 85 g,7891000296196,0
FOREST,Caramelos Sugus Confitados Acido 50G,7790580147983,3
FOREST,Corona Cerveza Rubia - Generic Brand - 410 ml,7792798012435,0
FOREST,Zanahoria Cocida Al Vacio,7798096882725,3
FOREST,Temple Honey Cerveza Miel - Patagonia - 473 mL,7792798008865,0
FOREST,Pico Dulce Chupetín - Generic Brand - 1 ud.,7792860001114,0
FOREST,La Serenísima Yogur Clásico Descremado Frutilla - Generic Brand - 900 G,7791337004924,0
FOREST,Estrella Quitaesmalte Restaurador - Generic Brand - 100 ml,7790064004719,0
FOREST,Frigor Epa Helado Crunchy - Generic Brand - 88 g,7613035242746,0
FOREST,Milka Huevo de Pascuas Chocolate con Leche Geo - Generic Brand - 22 g,77981325,0
FOREST,Papin Romero Y Ajo Cocidos Al Vacio,7798096882718,3
FOREST,Zucaritas Cereal De Chocolate - Zucaritas - 240 g,7896004004983,0
FOREST,Tidy Cats Convencional Piedras para Gatos - Generic Brand - 3600 g,8445290954190,0
FOREST,Galletas De Arroz Dulces X 101G - Arrocitas,7790538009707,3
FOREST,Ensalada Primavera  - Mia - 250 g,724751030979,0
FOREST,Jabón líquido Dove para manos nutrición profunda Rep. 220 Mi - Mia - 220 ml,27791293022264,0
FOREST,BAUDUCCO TOSTADA CLÁSICA 142GR,7891962060453,0
FOREST,Candela Lampara Led 9W Calida - Candela - 1 Und,7798347080030,0
FOREST,Ferrero Rocher Bombones - Ferrero Rocher - 3 ud.,78909434,0
FOREST,Kellogg's Corn Flakes Cereal Copos de Maíz - Corn Flakes - 200 G,7896004006321,0
FOREST,Lay's Papas Fritas Clasicas - Lays - 145 g,7790310984000,0
FOREST,Terma Patagónico  - Generic Brand - 1350 mL,7790950133356,0
FOREST,Mini Galletitas De Arroz Sabor Queso X 53G - Arrocitas,7790538009554,3
FOREST,Coca-Cola Sabor Original - Coca-Cola Original - 1750 ml,7790895007217,0
FOREST,Ndg Latte Macchiato 10Caps X112.5G Qb,7891000421451,3
FOREST,Smookies Galletitas Dulces Vainilla X 150G - Smookies,7798166860066,3
FOREST,Milanesas De Soja Organica Rellena De Aceitunas X 460G - Alkimyk Food,790757918955,3
FOREST,Nuggets Bocaditos De Tofu X 300G - Soyana,7798383880052,3
FOREST,Fargo Pan Integral Grano Entero - Mia - 350 g,7793890259377,0
FOREST,Downy Suavizante Admirable - Generic Brand - 500 ml,7500435172813,0
FOREST,Santa Rosa Queso Azul - Generic Brand - 1 Und,7791564000294,0
FOREST,Muecas Barra de Cereal Manzana y Arandanos - Muecas - 45 g,7798333090043,0
FOREST,Miel Sin Azucar X 280G - Mrs Taste,7896573360619,3
FOREST,Maquillaje para Cara Argentina  - Generic Brand - 1 ud.,9910015476305,0
FOREST,Budin Sabor Naranja X 200G - Schar,7898954933559,3
FOREST,Beepure Mantequilla de Maní - Mia - 360 g,7798165590872,0
FOREST,Pasta Organica Fusilli X 500G - Grun,7798015440012,3
FOREST,Cerveza Dos Dingos Sunset Amber Ale - Mia Regular Price - 330 ml,7798345250220,0
FOREST,Tostadas Keto Semillas X 100G - Simply Keto,7798426290176,3
FOREST,Vino Estancia Mendoza 750Ml,7790314079931,3
FOREST,Kony Dulce De Leche Con Stevia X 440G,7798382830362,3
FOREST,Helado Haulani Choco Blanco Y Frambuesa - Mia - 450 ml,7798322070483,0
FOREST,Muecas Barra de Cereal Sin Azucar Pasas y Arandanos - Muecas - 45 g,7798333090142,0
FOREST,ALMADRE PITA CHIPS DE MASA MADRE JALAPEÑO X 115G,7798371600631,3
FOREST,H&S Head Shoulders 3En1 Para Hombres Shampoo - Generic Brand - 375 ml,7500435182775,0
FOREST,Los Intocables Vino Tinto Intocables Blend - Generic Brand - 750 ML,7791540051913,0
FOREST,Johnnie Walker Whisky Blue Label - Johnnie Walker - 750 mL,5000267114279,0
FOREST,Sol Cerveza Rubia - Sol - 473 ml,7793147001704,0
FOREST,ALMADRE PITA CHIPS DE MASA MADRE CEBOLLA X 115G,7798371600624,3
FOREST,MUNDO CHIPA PAN DE CHIPA X 500G,7798399100038,3
FOREST,Froot Loops Cereales Anillos Frutales - Froot Loops - 300 g,7793306993529,0
FOREST,Beepure Mermelada de Frutos del Bosque - Generic Brand - 450 g,7798165590384,0
FOREST,Morixe Fideos Mostachol - Generic Brand - 500 g,7790199603504,0
FOREST,Frigor Chomp Bocadito Helado con Almendras - Generic Brand - 180 g,7613034790194,0
FOREST,Bimbo Artesano Pan Integral - Mia - 500 g,7793890258974,0
FOREST,Medalla Vino Malbec - Trapiche - 750 ML,7790240092011,0
FOREST,Mirinda Naranja - Mirinda - 500 mL,7791813420156,0
FOREST,Alicante Sabor en Polvo Gallina - Generic Brand - 4 Und,7790150432440,0
FOREST,Musli Cereales Kelloggs Con Chocolate - Musli - 255 g,7896004004990,0
FOREST,Skyn Preservativos Prime Extra Lubricado 6 Und,7791519702945,0
FOREST,El Peoncito Semillas De Sésamo Blanco - Generic Brand - 100 g,7791351128194,0
FOREST,1888 Sidra Saenz Briones - Generic Brand - 500 ml,7790119002196,0
FOREST,Helado Haulani DDL (Contiene Lactosa) - Mia - 450 ml,7798322070155,0
FOREST,Bauducco Cookies Galletitas Sabor Chocolate - Generic Brand - 100 g,7891962054490,0
FOREST,Sushi Combo Veggie Caja - Mia - 1 ud.,9910015467121,0
FOREST,Glade Aparato Aromatizador Limón Refrescante - Glade - 12 mL,7790520015730,0
FOREST,Mirinda Naranja - Mirinda - 1500 mL,7791813421153,0
FOREST,Garnier Mascarilla de Tela Hydra Bomb Hidratante - Generic Brand - 1 ud.,6923700977561,0
FOREST,Remolacha en Bolsa de Red - Mia - 600 g,9910015421201,0
FOREST,PLENITUD PANAL ADULTO CLASSIC G/XG 8 UN,7896007552962,3
FOREST,Musli Cereal Kelloggs Manzana Y Pasas De Uva - Musli - 270 g,7896004006581,0
FOREST,CALIPSO TOALLAS HIGIENICAS NORMAL C/EXTR SEDA 8 UN,7790770602070,3
FOREST,Vegetalex Milanesas Soja Espin + Fib Bsa - Generic Brand - 340 G,7790174000540,0
FOREST,MR NUT SEMILLAS DE GIRASOL,7792197060327,3
FOREST,Fancy Feast Alimento Humedo Gato Demi Glace - Generic Brand - 85 g,7891000295755,0
FOREST,Sushi Combo Mix Caja - Mia - 1 ud.,9910015467122,0
FOREST,MR NUT MIX TRADICIONAL,7792197070111,3
FOREST,Sampling Bandera para Auto 1 ud.,102022050152,0
FOREST,Colgate Hilo Dental Con Fluor Y Menta Blister etros - Colgate - 25 m,7891024183083,0
FOREST,Coco Iogo Yogur de Coco Sabor Natural 160 g - Generic Brand - 160 g,7798338250022,0
FOREST,Acondicionador Recarga Nutritiva Fructis Garnier - Full - 350 ml,7509552922233,0
FOREST,Alicante Sabor en Polvo Crema y Verdeo - Generic Brand - 4 Und,7790150438824,0
FOREST,Nescafe Cafe Gold - Generic Brand - 100 g,7506475116626,0
FOREST,MR NUT MIX CON BANANA (MIX TRADICIONAL + BANANA CHIPS),7792197070326,3
FOREST,PLENITUD TOALLAS HIGIENICAS FEMME NORMAL PLUS 16 UN,7794626010880,3
FOREST,Gorro Papa Noel Friselina - Generic Brand - 1 ud.,9910015476317,0
FOREST,Serenisima casan crem - 480 g,7791337003378,0
FOREST,Crema doble Pasteurizada Milkaut 205cc - Generic Brand - 205 mL,7794820902035,0
FOREST,MR NUT MIX SECO (NUEZ ALMENDRA Y CASTANA DE CAJU),7792197070234,3
FOREST,Ramo de Flores Pequeño Día de los Enamorados - Mia - 1 ud.,9910015052292,0
FOREST,Dove Acondicionador Ritual de Reparación Coco y Cúrcuma - Dove - 400 ml,7791293045221,0
FOREST,Sampling Guirnalda Bandera - 1 ud.,101908050217,0
FOREST,MR NUT GARRAPINADA DE MANI,7792197030436,3
FOREST,PLENITUD ROPA INTERIOR PROTECT PLUS G/XG 8 UN,7896007547173,3
FOREST,Fruver 5 - Mia - 1 ud.,9910015421124,0
FOREST,MR NUT ALMOHADITA RELLENA FRUTILLA ,7792197040237,3
FOREST,Latitud 33 Vino Malbec - Generic Brand - 750 mL,7790975017518,0
FOREST,Knorr Caldo Gallina 12 Cubos - Knorr - Empaque  1 g,7794000597525,0
FOREST,Pantene Acondicionador Pro V Fuerza Y Reconstruccion - Generic Brand - 400 ml,7500435168298,0
FOREST,Milkaut Dulce de Leche Clásico - Generic Brand - 405 g,7794820901991,0
FOREST,PLENITUD TOALLAS HIGIENICAS FEMME PLUS LARGA 8 UN,7794626014758,3
FOREST,Pehuamar Maní Repelado 351gr - Mia - 351 g,7790310983935,0
FOREST,BIG POT NATURAL GRIEGO ENDULZADO 300G,7791337010000,3
FOREST,Milkaut Yogur Descremado Frutilla - ''Presentación'' de 1 G,7794820901687,0
FOREST,MR NUT COPOS DE MAIZ CON AZUCAR ,7792197040527,3
FOREST,Cabrales Café En Saquitos - Generic Brand - 20 ud.,7790550010125,0
FOREST,MR NUT ALMENDRAS PELADAS,7792197010230,3
FOREST,MR NUT MANI TOSTADO Y SALADO ,7792197050311,3
FOREST,H2OH! Agua Saborizada Gasificada Sabor Limoneto - Generic Brand - 2250 ml,7791813423911,0
FOREST,Shot Huevo de Pascuas - Generic Brand - 210 g,7622201133023,0
FOREST,MR NUT MIX SECO (SIN PASA DE UVA) ,7792197070210,3
FOREST,Vegetalex Medallones Calabaza Avena Paq - Generic Brand - 300 g,7790174001219,0
FOREST,Let it V Ensalada de Quinoa - Mia - 1 ud.,9910015497228,0
FOREST,Not Chicken Nuggets - Generic Brand - 400 g,7798342150882,0
FOREST,Zanahoria - Mia - 1 ud.,9000000000011,0
FOREST,MR NUT SEMILLAS DE CHIA,7792197060129,3
FOREST,Ayudin Lavandina Común Clásica - Generic Brand - 1 l,7793253004439,0
FOREST,Felpita Papel Higienico 50 Metros - Generic Brand - 4 Rollos,7791828900261,0
FOREST,MR NUT SEMILLAS DE QUINOA,7792197060532,3
FOREST,Cagnoli Salame Tandilero Tipo Milán - Generic Brand - 150 g,7798013106828,0
FOREST,Patagonia Amber Lager - Mia - 410 ml,7792798005956,0
FOREST,MR NUT AVELLANAS PELADAS,7792197010629,3
FOREST,Banana VERDE - Mia - 1 ud.,9910015403276,0
FOREST,Ziploc Bolsa Frezeer Mediana - Mia - 20 ,7790520992321,0
FOREST,MR NUT ALMENDRAS PELADAS,7792197010216,3
FOREST,Gillette Prestobarba3 Sensitive Máquinas de Afeitar Desechables - Generic Brand - 2 ud.,7500435189415,0
FOREST,MR NUT MIX CON BANANA,7792197070319,3
FOREST,Natura Yerba Selección Especial - Mia - 500 g,7792198000315,0
FOREST,Menoyo Vinagre Manzana Pet - Generic Brand - 1 L,7790130000089,0
FOREST,YOGUR GRIEGO CON TOPPINGS CEREALES,7791337009967,3
FOREST,MR NUT AVELLANAS PELADAS,7792197010636,3
FOREST,MR NUT SEMILLAS DE CHIA,7792197060136,3
FOREST,Vivere Suavizante Para Ropa Regular Plancha Fácil - Generic Brand - ''Presentación'' 1 mL,7791290013582,0
FOREST,MR NUT MANI JAPONES ,7792197051011,3
FOREST,MR NUT NUECES PELADAS,7792197010117,3
FOREST,Nescafe Dolce Gusto Cafe En Capsulas Au Lait Capsulas - Generic Brand - 160 g,7613033174728,0
FOREST,Hileret Zucra Líquido Edulcorante (Formato Anterior) - Generic Brand - 400 ml,7794940000864,0
FOREST,Alicante Cocina en Bolsa Pollo A Las Finas Hierbas - Generic Brand - 30 g,7790150497500,0
FOREST,MR NUT NUECES PELADAS,7792197010124,3
FOREST,Bolsa con Ramo de Astromelias y Flores de Estación - Mia - 1 ud.,9910015052299,0
FOREST,Not Chicken Burger Crispy - Generic Brand - 200 g,7798342151407,0
FOREST,MR NUT PASA DE UVA RUBIA,7792197010438,3
FOREST,Cagnoli Bondiola Feteada - Generic Brand - 120 g,7798013103292,0
FOREST,Champignon Fileteado IQF Biomac 500gr - Mia - 500 g,7798184271295,0
FOREST,Milka Alfajor Triple Mousse Blanco - Generic Brand - 55 Gr,7622300457303,0
FOREST,Procenex Limpiador Liquido Antigrasa Lima - Generic Brand - 900 ml,7791130962803,0
FOREST,Queso Pategras Selección Santa Rosa - Generic Brand - 260 g,7791564136474,0
FOREST,Lysol Desinfectante Multisuperficies Pureza de Algodón - Lysol - 360 ml,7891035001055,0
FOREST,Karinat Cereza Doypack  - Generic Brand - 300 g,7798141132805,0
FOREST,La Morenita Capsulas de Cafe Honduras - Generic Brand - 10 Und,7790170903609,0
FOREST,Sancor Bebe 1 Leche Fluida Infantil  - Generic Brand - 200 cc,7798176009660,0
FOREST,MR NUT MANI BANADO EN CHOCOLATE,7792197030337,3
FOREST,Fruver 184 - Mia - 1 ud.,9910015403118,0
FOREST,MR NUT CASTANA DE CAJU SIN SAL,7792197010520,3
FOREST,Morixe Harina Maíz Blanco - Generic Brand - ''Presentación'' 1 Kg,7790199603368,0
FOREST,MR NUT MIX TRADICIONAL (NUEZ ALMENDRA CAJU Y PASAS DE UVA),7792197070128,3
FOREST,MR NUT SEMILLAS DE LINO,7792197060228,3
FOREST,La Virginia Cápsulas de Café Espresso - Generic Brand - 10 ud.,7790150090107,0
FOREST,Dove Crema Corporal Ritual Energizante Matcha dove crema corporal nutritive secrets matcha ritual energizant - Dove - 200 ml,7506306215887,0
FOREST,MR NUT SEMILLAS DE GIRASOL,7792197060334,3
FOREST,Mogul Dientes - Generic Brand - 150 g,7790580259600,0
FOREST,Cerveza Pampa Brewing Dorada Pampeana,7798339251141,0
FOREST,MR NUT DATILES DE EGIPTO,7792197020727,3
FOREST,Dada Sweet 7 Finca Las Moras - Generic Brand - 750 ml,7791540045745,0
FOREST,Blem Lustramuebles En Aerosol Original - Generic Brand - 360 ml,7790520028747,4
FOREST,Cruz de Malta Yerba Tradicional - Generic Brand - 500 g,7790070509048,0
FOREST,Cagnoli Leberwurst - Generic Brand - 150 g,7798013103155,0
FOREST,Aquarius Agua Saborizada Manzana - Generic Brand - 1500 ml,7790895640483,0
FOREST,Zafran  Galletitas Avena Coco Y Lino - Generic Brand - 1 ud.,7798187760130,0
FOREST,Pomelo - 1ud.,7798165242436,4
FOREST,Yogurt Milkaut entero vainilla con copos cereal 140g - Generic Brand - 140 Gr,7794820901946,0
FOREST,Gallo Arroz Doble Carolina - Generic Brand - 1 kg,7790070431578,4
FOREST,Cerveza Pampa Brewing Amber Ale,7798339251134,0
FOREST,Fruver 27 - Mia - 1 ud.,9910015421120,0
FOREST,Regalo Fernet - Buhero - 700 ml,2200000310330,0
FOREST,Estrella Algodon Clasico Paquete - Generic Brand - 75 g,7790064000261,4
