DS,product_name,ean,stock
FOREST,Listerine Enjuague Bucal Cuidado Total - Listerine - 500 ml,7891010619435,0
FOREST,Molto Palmitos Enteros  - Mia - 400 gr,7798138552272,0
FOREST,Alma Mora Vino Viognier - Generic Brand - 750 ml,7791540044540,0
FOREST,Harpic Gel Limpia Inodoros Citrus Power Plus - Harpic - 500 ml,7791130681421,0
FOREST,Johnnie Walker Whisky Red Label - Generic Brand - 750 ml,5000267014005,1
FOREST,Playadito Yerba Mate Suave - Generic Brand - 500 g,7793704000911,1
FOREST,Coca-Cola Sin Azúcar - Coca-Cola Sin Azucar - 354 ml,7790895067587,1
FOREST,Pera - Mia - 1 ud.,9000000000118,1
FOREST,Colgate Pasta Dental Total 12 Salud Visible - Colgate - 90 g,7509546679334,0
FOREST,Alwa Chips De Papas Rurales Sin Tacc - Generic Brand - 100 g,7798228500015,0
FOREST,Felpita Infinity Papel Higienico Doble Hoja 50 m - Generic Brand - 4 Und,7791828900285,1
FOREST,Tahití Salsa Chimichurri - Generic Brand - 270 g,7798116163018,0
FOREST,Repollo Rojo - Mia - 1 ud.,9910015421143,1
FOREST,Gatorade Isotonicas Manzana - Gatorade - 750 mL,7792170052271,1
FOREST,Sprite Lima Limon - Sprite - 500 ml,7790895000829,1
FOREST,Wapi Queso Mozzarella Bocconcino - Generic Brand - 160 g,7798096213598,0
FOREST,Bimbo Oroweat Pan Cereales - Bimbo - 600 g,7796989004292,0
FOREST,Pepsi Black - Pepsi - 500 l,7791813828365,1
FOREST,Cif Limpiador de Baño Ultra Rápido Gatillo - Generic Brand - 500 ml,7791290789906,0
FOREST,Empanadas de Carne Suave  - Mia - 3 ud.,9910015467172,1
FOREST,El Esteco Don David Vino Cabernet Sauvignon - Generic Brand - 750 ml,7790189000177,0
FOREST,La Campagnola Pure de Tomate Tetrabrik - Generic Brand - 520 g,7793360000485,0
FOREST,Bc La Campagnola Jugo En Polvo Naranja - Generic Brand - 10 g,7790580984113,0
FOREST,Querubin Suavizante Para Ropa Flores Silvestres - Generic Brand - 900 ml,7791905000921,0
FOREST,Prime Preservativos Texturado - Generic Brand - 3 ud.,7791519200069,0
FOREST,Dicomere Lentejon - Generic Brand - 1 kg,7793323004079,0
FOREST,Pote Helado Belgian Chocolate Häagen-Dazs 473 mL - Mia - Pote  1 mL,3415581113457,0
FOREST,Sensodyne Pasta Dental Neutrazucar - Generic Brand - 90 g,7896015520045,1
FOREST,El Peoncito Frutos Secos Mix Serrano - Generic Brand - 100 g,7791351130524,1
FOREST,Bimbo Pan Árabe Blanco - Bimbo - 230 g,7796989010293,0
FOREST,Chocoarroz Dulce de Leche - Mia - 22 g,7790070418203,0
FOREST,Yogurisimo Con Cereales Azucaradas Fort - Generic Brand - 166 g,7791337007642,1
FOREST,Elite Pañuelos Descartables Polisuavizado PAQUETE - Elite - 6 ud.,7790250054726,0
FOREST,Beldent Chicle Frutilla - Generic Brand - 10 g,77969118,0
FOREST,Ciruela en Bandeja - Mia - 400 g,9000000000133,1
FOREST,Rexona Desodorante Antit En Aerosol Invisible - Rexona - 150 ml,7791293045177,0
FOREST,Antares Cerveza Kolsch - Generic Brand - 473 ml,7798091030329,1
FOREST,Arcor Dulce de Membrillo - Generic Brand - ''Presentación'' 1 G,7790580504601,0
FOREST,Sprite Lima-Limon - Sprite - 1500 ml,7790895000447,0
FOREST,Bialcohol Alcohol Puro Porta Bot - Generic Brand - 1 L,7790139000400,1
FOREST,Pote Helado Cookies & Cream Häagen-Dazs 473 mL 1 - Mia - Pote  1 mL,3415581152456,0
FOREST,La Serenisima Yogur Entero Cremoso Vainilla - Generic Brand - 120 g,7791337007352,1
FOREST,Trapiche Vino Malbec - Trapiche - 375 mL,7790240094794,0
FOREST,Antares Cerveza Artesanal Honey - Generic Brand - 473 mL,7798091030299,1
FOREST,Smartwater Agua Sin Gas - Generic Brand - 1500 ml,7790895645785,1
FOREST,The Healthy Kitchen Pizza Vegana Ricota y Puerro - Generic Brand - 300 g,703158248255,0
FOREST,Antares Cerveza Scoth - Generic Brand - 473 mL,7798091030343,1
FOREST,Knorr Sopa Familiar Vegetales Con Fideos de Letras - Knorr - 108 g,7794000999336,0
FOREST,Zapallito Redondo - 1 ud.,7798165242443,1
FOREST,Halls Strong Lyptus - Halls - 28 g,7622210659026,0
FOREST,Lucchetti Pasta Tirabuzon - Lucchetti - 500 g,7790070336026,1
FOREST,Jugo en Polvo BC Limonada  - Generic Brand - 9 g,7790580984212,0
FOREST,Altos Del Plata Chardonnay - Generic Brand - 750 mL,7790975017037,1
FOREST,Morixe Avena Instantanea - Generic Brand - ''Presentación'' 1 G,7790199603320,0
FOREST,Bc La Campagnola Mermelada Light Ciruela - Generic Brand - 390 g,7793360131547,1
FOREST,Pote Helado Vainilla Häagen-Dazs 473 mL - Mia - Pote  1 mL,3415581101454,0
FOREST,Cocinero Aceite Girasol - Generic Brand - 900 ml,7790070012050,0
FOREST,Cafayate Vino Torrontes Dulce Tardio - Generic Brand - 750 mL,7790093521805,1
FOREST,The Healthy Kitchen Croquetas de Papa - Generic Brand - ''Presentación'' 1 G,757817954704,0
FOREST,Chovi Salsa Kebab White Vegetariana Sin Tacc - Generic Brand - 250 mL,8410422002018,0
FOREST,Coca-Cola Sabor Original - Coca-Cola Original - 354 ml,7790895000232,0
FOREST,Chocoarroz Blanco - Mia - 22 g,7790070418319,0
FOREST,Smirnoff Aperitivo Ice Original - Smirnoff - 473 ml,7791250003110,1
FOREST,Knorr Sopa Familiar Vegetales Con Fideo Caracol - Knorr - 108 g,7794000999350,0
FOREST,Georgalos Caramelos Miel - Generic Brand - 450 g,7790380016595,1
FOREST,Kansas Mayonesa Estilo Americano (American Mayonnaise) - Generic Brand - 400 g,7798334803130,0
FOREST,Sprite Lima Limón - Sprite - 1750 ml,7790895007248,1
FOREST,Alicante Pimienta Blanca Molida Sobre - Generic Brand - 25 g,7790150550588,0
FOREST,Milkaut Yogur Bebible Descremado Vainilla - Generic Brand - 1 l,7794820001653,0
FOREST,Magistral Detergente Limón Cremoso - Mia - 215 ml,7500435203098,0
FOREST,La Virginia Te Verde En Saquitos - Generic Brand - 20 ud.,7790150355084,0
FOREST,Cachafaz Blanco - Mia - 60 g,77934505,0
FOREST,Sedal Shampoo Ceramidas - Sedal - 340 ml,7791293030777,0
FOREST,Gillette Gel After Shave Piel Sensible - Gillette - 75 g,47400188082,0
FOREST,Morixe Fideo Tallarin - Generic Brand - ''Presentación'' 1 G,7790199603474,0
FOREST,Coca-Cola Light Lata - Coca-Cola Light - 354 ml,7790895001437,0
FOREST,Jorgito Alfajor Dulce de Leche - Generic Brand - 55 g,77905758,0
FOREST,Huggies Pañales Flexi Comfort Extra Extra Grande - Generic Brand - 15 ud.,7794626012990,1
FOREST,Cagnoli Salame Tandilero Picado Fino - Generic Brand - 120 g,7798013102738,0
FOREST,Johnsons Baby Toallas Húmedas - Johnsons Baby - 48 ud.,7891010568757,0
FOREST,Beefeater Dry Gin - Beefeater - 700 mL,5000299618417,1
FOREST,Quaker Cereales Honey Nut Oats - Quaker - 200 g,7792170000012,0
FOREST,Ballantines Whisky Finest - Ballantines - 700 ml,5010106113073,1
FOREST,Morixe Fideos Tirabuzón - Generic Brand - 500 g,7790199603481,0
FOREST,Jose Cuervo Tequila Especial - Jose Cuervo - 750 ml,7501035010109,0
FOREST,Godet Postre Vainilla (Versión Anterior)  - Mia - 70 G,7790580111113,0
FOREST,Secret Desodorante Femenino - Secret - 45 g,37000883425,0
FOREST,Always Suave Toallitas Femeninas Noches Tranquilas - Always - 16 ud.,7500435178884,0
FOREST,Cagnoli Jamon Cocido Genuino Feteado - Generic Brand - 120 g,7798013102875,0
FOREST,Dove Acondicionador Recontrucción Completa - Dove - 200 ml,7891150008816,0
FOREST,Pervinox Pervinox Incoloro Spray - Generic Brand - 40 ''Unidad de Medida'',7791848055262,1
FOREST,Skip Jabón Lí­Quido Para Ropa Fibercare - Generic Brand - 3 L,7791290790872,0
FOREST,Beldent Chicles Mentol - Generic Brand - 10 g,77942395,0
FOREST,Fruver 19 - Mia - 1 ud.,9910015403024,0
FOREST,Pampers Supersec Pañales Desechables XXG - Generic Brand - 16 ud.,7500435130905,0
FOREST,Jugo BC Manzana Roja - Mia - 8 g,7790580984717,0
FOREST,Corega Ultra Crema Adhesiva para Prótesis Sin Sabor - Generic Brand - 70 g,7794640171758,0
FOREST,"Ser Yogur Colchon de Frutas Frutilla, Arandanos y Granada - Generic Brand - 175 g",7791337008588,1
FOREST,El Peoncito Semillas de Lino - Generic Brand - 100 g,7791351128286,0
FOREST,Mermelada Bonne Maman Frambuesa 370 gr,3045320089349,0
FOREST,Merle Gin - Generic Brand - 750 ml,736684265243,1
FOREST,Poett Perfumante Alegra Tu Día - Mia - 250 mL,7793253003050,0
FOREST,"Procenex Limpiador Bebe Bot 1,8L - Generic Brand - Botella  1 l",7791130683821,0
FOREST,L'oreal Paris Elvive Crema De Tratamiento Pure Mascarilla - Generic Brand - 300 g,7509552876437,1
FOREST,Postre dulce de leche Godet  - Mia - 30 g,7790580110628,0
FOREST,Toddy Galletitas Chips de Chocolate R - Generic Brand - ''Presentación'' 1 G,7790310982846,0
FOREST,Bonne Maman Mermelada Durazno - Generic Brand - 370 g,3045320089325,0
FOREST,Lysoform Desinf de Sup Solución Total Lavanda - Generic Brand - 900 ''Unidad de Medida'',7790520995162,1
FOREST,La Serenisima Leche Uat Descremada Prebiotica - Generic Brand - 1 l,7790742358509,1
FOREST,Nutriveg Pochoclos Vainilla (Caramelo) - Generic Brand - 50 g,7798346130156,0
FOREST,Yogurisimo Yogurt Bebible Vainilla - Generic Brand - 900 ml,7791337008243,1
FOREST,Toallitas femeninas Siempre Libre Adapt Plus Noche y Dia Tela Suave con Alas - Mia - 16 ud.,7790010570831,0
FOREST,Godet Postre Chocolate (Versión Anterior) - Mia - 70 g,7790580111137,0
FOREST,Nuestros Sabores Chips de Zanahorias y Sal Marina - Generic Brand - 80 g,7798171732051,0
FOREST,Pedigree Alimento Para Perro Adulto Raza Pequeña Vital - Pedigree - 1500 G,7797453001564,1
FOREST,Matarazzo Pasta Spaghetti Integral - Mia - 500 g,7790070320858,0
FOREST,Bic Encendedor Mini - Bic - 1 ud.,70330913431,0
FOREST,Baileys Licor Salted Caramel Original - Baileys - 750 ml,86767701763,0
FOREST,Danette Copa Chocolate - Generic Brand - 100 g,7791337008113,1
FOREST,Always Toallitas Femeninas (Formato Anterior) - Always - 8 ud.,7500435167826,0
FOREST,Felices las Vacas Queso Mozzarella de Almendra - Generic Brand - 500 g,76625286228,1
FOREST,Alkimyk Milanesa de Soja Organica Queso Azul - Generic Brand - 460 g,790757918986,1
FOREST,Matarazzo Pasta Tirabuzón Integral - Mia - 500 g,7790070320841,0
FOREST,Pureza Harina Integral Paq X Kg - Mia - 1 kg,7792180134516,0
FOREST,Terrabusi Galleta Variedad Clásica 600 G - Generic Brand - 600 g,7622210649287,0
FOREST,Ayudín Lavandina Pureza Glaciar - Mia - 1 l,779325003746,0
FOREST,Beepure Ghee Manteca Clarificada - Generic Brand - 220 g,7798165591268,0
FOREST,Riera Tostadas Arroz Sin Sal Paq - 150 g,7790071080409,0
FOREST,Sprite Lima Limon Sin Azucar - Generic Brand - 1500 mL,7790895064173,0
FOREST,Citric Naranja Durazno - Generic Brand - 250 ml,7798085680745,0
FOREST,Dermaglos Corporal Hidratacion Profunda Emulsion - Generic Brand - 300 ml,7793742007569,0
FOREST,Celusal Sal Gruesa . Paq - Mia - 500 g,7791004000822,0
FOREST,El Peoncito Castañas De Cajú Saladas - Generic Brand - 100 g,7791351003347,0
FOREST,Amande Bebida de Almendras Sabor Original sin Azucar - Generic Brand - 1000 ml,7790890070049,1
FOREST,Sussex Clásico 50 Paños - Generic Brand - 3 ud.,7790250056843,0
FOREST,Rexona Jabón En Barra Sensible - Mia - 125 g,7791293031927,0
FOREST,Morixe Rebozador  - Generic Brand - 1 Kg,7790199602941,0
FOREST,Pura Frutta Jugo Multifruta Kids - Generic Brand - 250 ml,7798259439612,1
FOREST,Wakas Risoni de Alubia Clasico - Generic Brand - 300 g,7798031470581,1
FOREST,Cicatricure – Gel Para Cicatrices - Generic Brand - 60 G,7798140259114,0
FOREST,Gillette Prestobarba3 Afeitadoras Desechables Mujer - Gillette - 2 ud.,7702018874781,0
FOREST,Schatzi Avena Arrollada Gruesa - Generic Brand - 300 g,7790513005687,1
FOREST,La Mascota Vino Malbec  - Mia - 750 ml,7790762150121,0
FOREST,Estrella Jabon Con Glicerina Ba Paq  - Mia - 75 g,7790064104525,0
FOREST,NO INGRESAR STOCK ACA POR FAVOR !!! Espumante Dolores Extra Brut   - Mia - 750 ml,77912501,0
FOREST,Schatzi Granola Potencia - Generic Brand - 400 g,7790513005519,1
FOREST,Alicante Bicarbonato de Sodio Sobre - Generic Brand - 50 g,7790150430392,0
FOREST,Heredia Infusion Hibiscus Enebro y te Verde - Generic Brand - 78 g,7798003742579,1
FOREST,Colgate Cepillo Dental Extra Clean 2X1 - Mia - 1 Ud,7702010630422,0
FOREST,Heredia te Verde Con Limon y Naranja - Generic Brand - 45 g,7798003741107,1
FOREST,Beepure Dulce Mermelada Artesanal de Frambuesa - Generic Brand - ''Presentación'' 1 G,7798165590377,0
FOREST,Dove Jabón En Barra Original x3 - Dove - 90 g,7891150046481,0
FOREST,Heredia Te Surtido Bienestar - Generic Brand - 30 g,7798003740698,1
FOREST,Sueño Verde Ensalada Del Cocinero Bandeja - Generic Brand - 200 g,7798096881490,0
FOREST,Rutini Vino Malbec - Mia - 750 ml,7790577001151,0
FOREST,Átomo Arnica  +  Aloe Vera Gel - Generic Brand - 30 G,7798024550566,0
FOREST,Pepsi Regular - Mia - 500 ml,7791813555032,0
FOREST,Arytza Mostaza a la Miel - Generic Brand - 360 g,7798126291053,1
FOREST,Molinos Ala Dips de Arroz Horneados - Generic Brand - 120 g,7791120098352,0
FOREST,Beepure Miel Cremosa - Generic Brand - 500 g,7798165590193,0
FOREST,Kotex Tampon Medio - Kotex - 8 ud.,7793620002099,0
FOREST,Sueño Verde Ensalada Americana Ban - Generic Brand - ''Presentación'' 1 G,7798096881537,0
FOREST,Ancestral Pasta Untable Mani y Coco - Generic Brand - 200 g,763571730393,1
FOREST,Clight Jugo En Polvo Naranja Durazno - Mia - 7 g,7622201807634,0
FOREST,,X00000X000115,0
FOREST,Midermus Gel Post Solar Dosificador - Generic Brand - 240 g,7794207000514,0
FOREST,Petit Naranja - Generic Brand - 1 L,7798085681001,0
FOREST,Alma Mora Cabernet Sauvignon - Mia - 750 mL,7790240042085,0
FOREST,Noly Pan Lacteado sin Colesterol - Generic Brand - 600 g,7790606000391,1
FOREST,Ser Yogur Descremado Firme Sabor Frutilla - Generic Brand - 190 g,7791337007864,1
FOREST,La Salteña Tapas Para Empanadas Criollas  - Generic Brand - 412 G,7790236001300,0
FOREST,Sueño Verde Ensalada Power Veggie Bandeja - Generic Brand - 175 g,7798096881513,0
FOREST,Yogurisimo Yogur Parcialmente Descremado Sabor Frutilla - Generic Brand - 190 g,7791337009387,1
FOREST,Gillette Venus Breeze Cartuchos Para Afeitar - Gillette Venus - 2 ud.,7506339315899,0
FOREST,Casero y Natural Roll de Ternera Listo para Comer - Generic Brand - 292 g,9910015467374,1
FOREST,Citric Naranja Sin Pulpa - Generic Brand - 1 l,7798085681568,0
FOREST,Benchmark - Generic Brand - 750 ml,88004020842,1
FOREST,Wapi Queso Camembert - Generic Brand - 200 g,7798096210252,0
FOREST,Zafran Almendras - Generic Brand - ''Presentación'' 1 G,7798187760468,0
FOREST,Sueño Verde Ensalada Gringa Bandeja - Generic Brand - 180 g,7798096881520,0
FOREST,Trumpeter Vino Blanco Sauvignon Blanc - Generic Brand - 750 mL,7790577040525,1
FOREST,Hinojo Agroecologico Premium - Mia - 1 ud.,9910015421092,0
FOREST,Ades Soja  +  Jugo de Frutas Tropicales 200 mL - Ades - 200 mL,7790895643767,1
FOREST,Toallas Húmedas Johnson's Baby De la Cabeza a los Pies 44 u - Mia - 1 ud.,7891010251024,0
FOREST,Fruver 50 - Mia - 1 ud.,9910015421093,0
FOREST,Dove Men Desodorante En Aerosol Cuidado Total - Generic Brand - 150 g,7791293012087,0
FOREST,H2oh Agua Saborizada Limon Sin Gas - Generic Brand - 1500 mL,7791813403029,1
FOREST,Petit Manzana Pera  - Generic Brand - 1 L,7798085681117,0
FOREST,Laur Vino Tinto Malbec 3 Hectareas - Generic Brand - 750 mL,7798159949143,1
FOREST,Sense Alimento Lacteo Sabor Cappuccino - Generic Brand - 200 ml,7790742872661,1
FOREST,Riera Tostadas Arroz Sin Gluten - Generic Brand - 150 g,7790071080201,0
FOREST,De mi Campo Salsa Criolla Picante  - Mia - 250 ml,7798089094463,0
FOREST,Cachafaz Conito de Dulce de Leche - Generic Brand - 1 ud.,77990327,0
FOREST,Ritter Sport Relleno Con Mazapan 100 Gr. Chocolate Alemán,4000417025005,0
FOREST,Paladini Bondiola Feteada  - Generic Brand - 120 g,7790079022623,0
FOREST,Exquisita Bizcochuelo Chocolate  - Generic Brand - 540 g,7790070410146,0
FOREST,Mortimer Esponja Cuadriculada - Generic Brand - 1 ud.,7793253038106,0
FOREST,Pedigree Alimento para Cachorro con Nutri Defense - Pedigree - 1500 g,7797453001502,1
FOREST,Sueño Verde Noodles Batata Bandeja  - Mia - 250 G,7798096881254,0
FOREST,Citric Pomelo con Menta - Generic Brand - 1 l,7798085681216,0
FOREST,Ayudin Lavandina en Gel Original - Mia - 700 ml,7793253000998,0
FOREST,Dermaglós Protector Solar Bebés Fps 50 - Generic Brand - 150 g,7793742033759,0
FOREST,Green Food Makers Bebida de Almendra Sabor Chocolate  - Generic Brand - 330 mL,701822717830,1
FOREST,La Virginia Te De Boldo En Saquitos x 25 - Generic Brand - Caja 1 g,7790150310137,0
FOREST,Union Ganadera Hamburguesas de Carne Clásicas  - Generic Brand - 332 G,7793281492390,0
FOREST,Skip Jabón en Polvo para Ropa Clásico Baja Espuma - Mia - 2500 mg,7791290789821,0
FOREST,Bastoncito de Port Salut Light - Generic Brand - 290 g,724373748924,1
FOREST,Coony Mascara Facial - Generic Brand - ''Presentación'' 1 Und,8809192704206,0
FOREST,Celusal Sal Parrillera Entre Fina - Mia - 500 g,7791004000839,0
FOREST,AGUILA BANO SEMIA 150G ST,7790580131487,0
FOREST,Nutrilon The Blenders Leche Fluida Infantil Etapa 1 - Generic Brand - 200 ml,7795323774563,0
FOREST,Lechuga Romana Triple Lavado - Mia - 250 g,724751031013,0
FOREST,Amoedo Burritos Integrales de Mijo Zap - Generic Brand - 260 g,7798342730602,1
FOREST,The Healthy Kitchen Pizza Vegana Brócoli y Tomates Secos  - Generic Brand - 300 G,703158248286,0
FOREST, Lays Papas Fritas Clásicas  - Lays - 330 g,7790310985588,1
FOREST,De mi Campo Mix De Frutas Secas 100 Grs - Mia - 100 g,7798089090441,0
FOREST,GORDON'S PREMIUM PINK 6X700 - Generic Brand - 700 ml,7791250003325,1
FOREST,Hisopos Estrella Pote 125 Un - Mia - 125 ud.,7790064104716,0
FOREST,Byourfood Mantequilla de Mani Natural Sin Endulzante - Generic Brand - 220 g,723540583320,1
FOREST,Cofler Rellenas Bon O Bon - Generic Brand - 85 g,7790040143807,1
FOREST,Le-Fit Mantequilla De Mani con Stevia - Generic Brand - 590 g,754697523723,1
FOREST,Franui Chocolate Amargo - Generic Brand - 150 g,7798147780062,0
FOREST,Fruver 190  - Mia - 1 ud.,9910015421098,0
FOREST,Felices Las Vacas Jamon En Fetas - Generic Brand - 150 g,727373025675,1
FOREST,Not Burger Hamburguesas Veganas (4 unidades)  - Generic Brand - 320 g,7798342150646,0
FOREST,Disco Estrella Desmaquill 80 Un  - Mia - 1 Ud,17790064001906,0
FOREST,Cagnoli Fuet Tandil - Generic Brand - 150 g,7798013100697,0
FOREST,Nesquik polvo 180gr  - Mia - 180 g,7613034450081,0
FOREST,Franui Leche y Choco Blanco - Generic Brand - 150 g,7798147783223,0
FOREST,Kolynos Cepillo Dental Doctor Medio - Colgate - ''Presentación'' 1 Und,7891528091716,0
FOREST,Menoyo Vinagre De Alcohol - Generic Brand - 500 mL,7790130000034,1
FOREST,Cif Limpia Vidrio Gatillo 500 gr - Mia - 500 ml,7791290789937,0
FOREST,Noly Rodajas Finas - Generic Brand - 360 g,7790606000186,1
FOREST,Top Line Chicle 7 Frutilla - Generic Brand - 1 Und,77951113,0
FOREST,De mi Campo Blend de Pimientas - Mia - 50 g,7798089091486,0
FOREST,Levite Agua Saborizada Pomelo Sin Gas - Levite - 1500 ml,7798062548679,0
FOREST,Ayudin Quitamanchas Ultra Doypack - Mia - 450 g,7793253002589,0
FOREST,Sándwich de Jamón Crudo y Queso Brie  - Mia - 1 Ud.,9910015467031,0
FOREST,Paladini Mortadela Feteada Al Vacío - Generic Brand - 200 g,7790079011597,0
FOREST,Mortimer Esponja Acero Plateada Paq - 1 Ud,7793253386160,0
FOREST,Quaker Barras de Cereal Mousse De Chocolate (CAJA X 6 BARRITAS) - Quaker - 156 g,7792170001040,0
FOREST,Prime Preservativo Retardante - Generic Brand - 3 ud.,7791519702112,0
FOREST,Coca-Cola Sin Azucar - Coca-Cola Sin Azucar - 500 ml,7790895067532,0
FOREST,Aspen Termometro Dig Feverblue X1 Mt31 - Generic Brand - 1 ud.,7790808036631,0
FOREST,Bimbo Pan De Mesa Blanco Liviano - Mia - 550 g,7793890259032,0
FOREST,Always Xtra Tripl Prot Nc Sua T3 16X12It - Generic Brand - 68 g,7500435229517,1
FOREST,Kitchenita Wrap Veggie - Mia - 1 ud.,9910015467100,0
FOREST,Hs Sh Apple Po 375Mlx12It - Generic Brand - 429 g,7500435019880,1
FOREST,Bagley-Criollitas Galletitas de Agua Lacteadas - Generic Brand - ''Presentación'' 1 G,7790040047013,0
FOREST,Sueño Verde Ciboulette Bandeja - Generic Brand - 30 g,7798096880110,0
FOREST,Pehuamar Papas Fritas Acanaladas - Generic Brand - 140 Gr,7790310984154,0
FOREST,Fanta Pomelo 1.75L - Generic Brand - 1750 ml,7790895647895,1
FOREST,Purina ONE Gato Salmon x 6 KG - Generic Brand - 6000 g,7613287230461,1
FOREST,De mi Campo Sal Orgánica Saborizada 170 Grs - Mia - 170 g,7798089094043,0
FOREST,Alicante Provenzal 25 G - Generic Brand - 25 g,7790150570180,0
FOREST,The Healthy Kitchen Pizza Vegana Zanahoria y Curry - Mia - 300 g,751211954797,0
FOREST,Natier Capsulas de Resveratrol - Generic Brand - 50 g,7798121272125,1
FOREST,Roots Remolacha Espiralizada - Generic Brand - ''Presentación'' 1 G,7798096881261,0
FOREST,Esponja de Friba Mortimer Cuadrada Antibacterial - Mia - 1 Ud,7793253381035,0
FOREST,Natura Aceite De Girasol - Natura - 900 mL,7790272001005,0
FOREST,Natier Capsulas de Curcuma - Generic Brand - 50 g,7798121272385,1
FOREST,Milkaut Queso Unt Light Port Salut Tra Pot - ''Presentación'' de 1 G,7794820015278,0
FOREST,La Virginia Café Instantáneo Descafeinado - Generic Brand - 170 g,7790150110386,0
FOREST,Repelente Off Ext.Dur.Aer 165 Gr - Mia - 165 mL,37790520009501,0
FOREST,Alcaraz Cristo De Los Cerros Berenjenas - Generic Brand - 300 g,7791479000068,0
FOREST,Franks Pan con Trigo Sarraceno - Generic Brand - 300 g,7798340790295,1
FOREST,Recetas de Entonces Pure de Berenjenas Asadas y Sesamo Babaganush - Generic Brand - 200 g,7791479001140,1
FOREST,Citric Jugo Naranja - Generic Brand - 500 ml,7798085681452,0
FOREST,Not Milk Bebida Vegetal - Generic Brand - 1 l,7798342151469,0
FOREST,Dermaglós Emulsión Post Solar Hidratante - Generic Brand - 300 ml,7793742003974,0
FOREST,CEPITA TETRA 20% NAR 1Lx8 - Generic Brand - 1 L,7790895648267,1
FOREST,Fruver 62 - Mia - 1 ud.,9910015421094,0
FOREST,Levité Cero Agua Saborizada Pomelo Sin Gas - Generic Brand - 500 mL,7790315100177,0
FOREST,Listerine Enjuague Bucal Freshburst - Listerine - ''Presentación'' 1 mL,7891010618094,0
FOREST,Don Vicente Pasta Tallarin - Generic Brand - 500 g,7790070336576,0
FOREST,Higienol Papel Higiénico Doble Hoja 30 MTS - Generic Brand - 4 ud.,7790250019589,0
FOREST,POT Helado de banana y dulce de leche natural - Generic Brand - 250 g,9910015385425,1
FOREST,Verde Flor Yerba Mate Compuesta Con Hierbas Serranas - Generic Brand - ''Presentación'' 1 G,7793670000052,0
FOREST,Gati Croqueta para Gato Sabor Salmn con Vegetales 1kg - Generic Brand - 1000 g,8445290584984,1
FOREST,Shampoo Tresemme Hidratación Profunda 750 Ml - Mia - 750 ml,7791293033716,0
FOREST,Coco Iogo Yogurt Maracuyá - Generic Brand - 160 g,7798338250039,0
FOREST,Sueño Verde Ensalada De Hojas Crujientes - Mia - 300 g,7798096880578,0
FOREST,Hellmann's Mayonesa Clásica - Generic Brand - 237 g,7794000004825,0
FOREST,Knorr Sopa Crema Choclo - Mia - 67 g,7794000004320,0
FOREST,Pureza Harina Leudante Paquete - Pureza - 1 Kg,7792180004888,0
FOREST,Quaker Barras de Cereal Sabor Frutillas con Crema (CAJA x 6 BARRITAS) - Quaker - 180 g,7792170001095,0
FOREST,TODDY ALFAJOR MOUSSE,7790380023579,1
FOREST,Milkaut Queso Crema Light - Generic Brand - 290 g,7794820901588,0
FOREST,Cepita Naranja - Generic Brand - 200 ml,7790895641596,0
FOREST,Deo.Nivea Ap H Invisib B W Men Fresh 150Cc - Generic Brand - 150 ml,7791969001032,1
FOREST,Quaker Cereales Honey Nuts Oats - Quaker - 190 Gr,7792170555376,0
FOREST,Sueño Verde Espinaca Bolsa - Mia - 300 g,7798096880332,0
FOREST,Kotex Toallitas Femeninas Esencial Normal con Alas - Kotex - 8 ud.,7794626010316,0
FOREST,Dove Acondicionador Ritual Detox - Dove - 400 ml,7891150062771,0
FOREST,Espárrago Atado - Mia - 1 ud.,9910015421137,0
FOREST,Pañales Babysec Ultrasoft Xg 32 Un - Generic Brand - 32 Und,7790250042075,1
FOREST,Nivea Crema Antiarrugas Q10 Energy Dia Fps 15 - Nivea - 1 ud.,4005900797209,0
FOREST,Chaucha - Generic Brand - 400 g,9910015421445,1
FOREST,Romero - Generic Brand - 1 Und,9910015421451,1
FOREST,Cepita del Valle Jugo Manzana  - Mia - 1 l,7790895647017,0
FOREST,Fruver 134 - Mia - 1 ud.,9910015421097,0
FOREST,Tomillo - Generic Brand - 1 Und,9910015421454,1
FOREST,Huggies Toallitas Húmedas Classic  - Mia - 48 Ud.,17794626003032,0
FOREST,Gillette Mach3 Cartuchos Para Afeitar - Gillette - 2 ud.,7500435198097,0
FOREST,Evacopa Copa Menstrual Talle 1 - Generic Brand - 1 ud.,7796285285135,0
FOREST,Empanadas Zën Jamón y Quesos x 12 u  - Mia - 1080 G,7798353140094,0
FOREST,Galletitas De Salvado Cerealitas 624G - Generic Brand - 624 g,7622201746032,1
FOREST,Nivea Máscara de Papel Q10 + C - Generic Brand - 1 Und,4005900623522,0
FOREST,Quaker Avena Integral Instantánea - Quaker - 660 g,7792170555338,0
FOREST,Bonafide Sensaciones Café Molido Torrado Suave - Generic Brand - 1 kg,7792360002383,0
FOREST,Plusbelle Acondicionador Hidratación Intensa - Generic Brand - ''Presentación'' 1 L,7790740502454,0
FOREST,Jalapeño Mix en Bandeja - Mia - 1 ud.,9910015421099,0
FOREST,Lucchetti Arroz Largofino - Lucchetti - 500 g,7790070431493,0
FOREST,Salame Sorpresata Cagnoli 135Gr - Generic Brand - 135 g,7798013100246,1
FOREST,Dos Anclas Sal Gruesa Caja - Generic Brand - 500 g,7792900092676,0
FOREST,Milkaut Yogurt Entero Reducido en Lactosa Sabor Frutilla - Mia - 125 g,7794820901755,0
FOREST,Marshmallows Twist Vainilla x 28 gr - Mia - 28 Gr,7798130956931,0
FOREST,Salamin Tandilero Picante Cagnoli X 145 Gr - Generic Brand - 145 g,7798013108068,1
FOREST,Schweppes Tónica Zero 1.5 Lt,7790895648014,1
FOREST,Rexona Desodorante Antit Bolilla V8 - Rexona - ''Presentación'' 1 mL,78923454,0
FOREST,Limpiador Ayudin Antihongos Repuesto 500 Ml - Mia - 500 ml,7793253179267,0
FOREST,Bonafide Bocadito DDL - Generic Brand - 16 g,7792360070047,0
FOREST,Alwa Chips De Batatas Rusticas Sin Tacc - Generic Brand - 80 g,7798228500114,0
FOREST,Citric Manzana - Generic Brand - 250 ml,7798085681650,0
FOREST,OB Tampones ProComfort Mini - Ob - 8 ud.,7891010245597,0
FOREST,Cif Baño Limpiador Biodegradable - Mia - 450 g,7791290789913,0
FOREST,Ayudín Toallitas Húmedas Limón - Mia - 24 ud.,7793253003395,0
FOREST,Manzana Roja - Mia - 1 ud.,9000000000111,0
FOREST,Aquarius Zero Manzana 2.25 Lt,7790895011771,1
